,lyrics
56,A ja Da ja genij kak Evgenij Ponasenkov Esli b batja byl umnee ty b ostalsja na salfetke JA by vzorval dazhe v shkole za partoj Ty ne vzorval by s trotilovoj shashkoj CHuvstvuesh' ehti kazahskie vajby JA kak McLaren ty kak Mak Traher vou JA dvigajus' budto ja Lyoha Naval'nyj Paru nedel' polezhal na divane chtoby vy vse poohuevali Tolstyj usatyj  da ja kak Pablo JA dvigajus' rovno so mnoj moja banda JA dvigajus' rovno dvigajus' plavno Doroga budto tvoja baby mama ploskaja Ni s huja shot v tebja budto shotik viskarja Vyebonju ja ne sporju Ty ne ponjal to chto ja  legenda budto by ja Egor Krid Vidimonevidimo nalichnyh oni ne vlezajut v koshel'ki shkishki Varim stil' ja SHul'gin pod 2CB Ty vedesh' sebja kak bi tebja zarollim v OCB Saljut Sibir' U vas est' sneg i on besplatnyj Ni na chto ne namekaju no tak mutjatsja startapy Reperki za ehti grammy by prodali svoju mamu Tri sotni budto sparta Saljut vsem moim shalavam Jeeeeeee hou Budto Lebron i Didzhej Paul Vas uberu odnoj rukoj Tvoim kentam pora domoj Repery kurjat no kurjat nepravil'no Videl vse ih kosjaki oni malen'kie Delajut ehto no tol'ko na kameru Da vy na paleve da my napaleny Bazarju rovno kak Pudge Golos budto prostuzhen SHmouk tebja obezoruzhit eeeeeee hou Kogda vodila protjanul kosjak Vse moi volki delajut zatjag Fedja Buker Vyberi zhizn'  al'bom 2021 pankrok pankrehp Pohuj voobsze Prrrr jeeeee hou Mua  EHj ehj Dzhubili  on blizhe chem vy dumali My zarabotali vse gryzhu kogda dunuli EHj Blant zhirnyj budto kashalot JA znaju tvoyo imja budto ja artist SHarlot No ja ne znaju svoyo imja budto ja artist SHarlot Blja ja zabyl blja kak popal sjuda blja kak blja ja zabil blja ja zaplyl kak blja plovec Kak NLO ja ostavljaju pod soboj polja kolec ehj Sljuni kapajut na tel'ce A my belen'kuju vodku glushim zalpami kak El'cin Glushit tankom belyj dom ehj JA Leopol'da s#el  pizdatyj sup s kotom A chto potom esli sluchilsja sup s kotom uzhe Kare jagnenka prjamo na moem nozhe A nozhik v levoj po ugaru JA bandjugan i derzhu vilku tol'ko v pravoj  narushaju ehtiket ehj Vse ehto lol i sami ehti treki kek Ili net EHto ne lol i mozhet byt' ehto ne kekkekkekkekkek  Podpisyvajtes' na moj patreon Za 3 baksa normal'no kak by no s pjatyorki Slava sam s pjatyorki nachinal szas uzhe na desjatku pereshyol Nu tak Nu nasobirali konechno ehj JA ne vidal nikogda Ajvana iz Lenina Paket Govorjat on nosit po prospektu lenina paket Govorjat u nego v karmane nemerenno galet On Vladimir Kozyreva perepel pesnju Buket Buker ne znaet kto takoj Ajvan Buker ved' pank ehto styd i sram Ved' Ajvan byl pervyj kto zachital pod gitar Kto vyvoril ves' ajvar i poel ajva Plyvut parahody  privet Ajvanu Letjat parovozy my ne narkomany My vegany no ja tol'ko mjaso em Uvazhaju bor'bu za kavkazskij balet Pljus u Ajvana rjukzak tuda vlezet more Tam sebe mozhet najti sebe karmashek i Gleb Morev Mozhet byt' tam sprjatalsja i Babangida Ajvan vygoni ego ottuda nasil'no Ajvan Ajvan gubernator Obninska Vanja Ajvan Vanjusha rodnen'kij Vse hotjat sol'nik ot Vani Ajvana Slushat' muzonchik i v vanne poplavat' Ajvan Ajvan gubernator Obninska Vanja Ajvan Vanjusha rodnen'kij Vse hotjat sol'nik ot Vani Ajvana Slushat' muzonchik i v vanne poplavat' EHj podpisyvajtes' na moj patreon Www tochka patreon tochka com slehsh ehto kosaja cherta takaja zamay86 Eszyo raz za tri baksa normal'no za pjat' uzhe mozhno tekst zachitat' 10  vy popadyote v chat za 15  ehkskljuzivnye onlajnkoncerty vot prjam kak sejchas 25 uroven' JUrij Dud' skidki na bilety nu a za 100 v mesjac my vas primem v Antihajp Vot Slava poka nu ne podkopil no skoro podkopit EHj ehj ehj Ajvan Ajvan gubernator Obninska Vanja Ajvan Vanjusha rodnen'kij Vse hotjat sol'nik ot Vani Ajvana Slushat' muzonchik i v vanne poplavat' EHj  Navernoe oden' luchshe Nadet' nado da Da da CHyoto muzyki net nihuja O poshla poshla Nu davaj JA kruchu v svoej tarelke vot tak vot tak Ne byval ne perestrelke nishtjak nishtjak Stavochki prohodjat chyoto proishodit Musora prihodjat ne nahodjat i uhodjat ehj Ebat' huja ty tam ebashish' bljad' A tebja kak zvat' Diman A ja cherepaha nu ili svjatoj Pavel Docha docha ty kuda Papik edet s povoda Nuka bystro narjadilas' i priyobyvaj sjuda Docha docha ty kuda Papik edet s povoda Nuka suka narjadilas' bystro tebe pizda Nihuja bljad' pro tyolku bljad' Ty nahuj ne Dimonchik bljad' ty  zachitin'e yopty kak futbolist U menja v krovati bad trip pau Devochka lezhit i drozhit pau Pacany tak ljubjat ehtot bit posmotri u operatora stoit Aj bljad' nihuja U menja v krovati bad trip pau Devochka lezhit i drozhit pau Pacany tak ljubjat ehtot bit Nu smotri u nego tam real'no huj stoit Haha dada A vy snimali JA ne meshaju vam Nu da Hochesh' poprobovat' Poprobuj brat davaj JA pomnju pesnju odnu mne nravitsja Smejtes' serdce Ne seli batarejki smejtes' Serdce ne seli batarejki smejtes' Serdce ne seli batarejki smejtes' JA Da vsyo normal'no i tak bylo horosho Ne par'sja vsyo Prikol'nuju vy tut hujnju delaete Nu da vsyo spasibo Davaj CHerepaha ili svjatoj Pavel Krishtiano Denzi Da  EHj ehj ehj Hahahm Kak obychno seryj flou seryj Piter vse na dvizhe kak obychno EHj wassup ehj Homeboy Ghetto Run malo poloviny gramma Napishi hujnju v kommentah moj bitmejker s Dagestana Homeboy Ghetto Run malo poloviny gramma Po receptu djadi Pashi pol lista alprozolama ehj Streljaju v musorov kak v VALORANT Pjat' shest' sem' vosem' novyh tati na respaun aj My po hruszevkam po dvoram Esli hachi govorjat to nasha vera  Biboran Ved' ja  rebenok indigo ljubov'ju ne obdelennyj Moja mamanja Genri kot ot Hofmanity s Pugachevoj Amo ne amo che Amo peredaj napas Ty ne poluchish' moi den'gi Palim shljuh budto GLONASS ehj My tratim mnogo tratim na hujnju Sredi ikon i voska  ja v krasnom uglu Strashnee chem dlja detok mefedron JA zarjazhaju paru soten mame Morgena v abort ehj Moj dom ehto gulag i ehto fakt JA perenes svinnoj gripp pjat' koron i kataraktu dve ehboly i vetrjanku  achievement unlocked JA tot samyj kto vnosil za Romu ZHeludja zalog ehj Tiktokeram loukikom po kolenu JA puskaju po vene vmeste s Vaengoj Elenoj ehj Bazaru net u kazhdogo problemy Tvoju suku porjat vo dvore pod pesenki Gansehllo Malo poloviny gramma Napishi hujnju v kommentah moj bitmejker s Dagestana Homeboy Ghetto Run malo poloviny gramma Po receptu djadi Pashi pol lista alprozolama Homeboy Ghetto Run malo poloviny gramma Napishi hujnju v kommentah moj bitmejker s Dagestana Homeboy Ghetto Run malo poloviny gramma Po receptu djadi Pashi pol lista alprozolama Fristajl Vsrap trushnyj chuvak voprosov tut net CHitaju s telefona slovno yoban da on konkretnyj uebok JA chitaju tut sidit blja Turkin Artem Sasha za kameroj emu vse nipochem Tut Sasha na zvuke chitaet legko bljat' JA poedu bljat' umru doma EHto budet bljat' Kloukoma Otkachajut vrachi da ty noch'ju drochi suka bljat' ne molchi ehj Vsrap tochka ru slesh cmh prodajut ne hujnju ehto ne mam kupi ehto papa prodaj Papa zhivi suki popadajut v raj ehj Vsrap tochka ru slehsh CMH zahodi tuda suka i ostav' tam laveh Vsrap tochka ru bljat' slesh CMH Da my suka na gidre ehj  Bratishka Bratish Je je JA na mefedrone s vodkoj s vodkoj Zapivaju vodku buhlom Mam ja dolzhen byt' myortvym myortvym A chto mne eszyo ostaetsja JA na mefedrone s vodkoj s vodkoj Zapivaju tranki buhlom Mam ja dolzhen byt' myortvym myortvym A chto mne eszyo ostaetsja Trahajus' s sukoj slovno ja zhenat Izvini malyshka tvoi sis'ki  laminat Glazhu tvoj lobok on pohozh na moju shljapu Glazhu tvoj lobok ty kak budto Pavel JAsman Ou zarjazhaju srazu avtomat JA streljaju krepko slovno v glotke butirat Vse moi stroki  jadernye bomby Vse tvoi stroki  sochnye kak pompovyj drobovik JA streljaju tebe v zhopu Zarjazhaju srazu slovno ja Globa Vizhu po zvyozdam ja budu s toboj Vizhu po zvyozdam no prosti ja goluboj JA ne trahajus' s babami trahajus' s krutymi Trahajus' s takimi kto znaet moyo imja Zamaaaaaaaaj Poprobuj ugadaj kuda ja zasunu ehti den'gi Poprobuj ugadaj zachem mne voennik Ne hodil v armiju v armii est' Moj ljubimyj praporszik  avtomat ZHest' kak stelju vizhu chto ty seljuk Ves' tvoj stilyok prilyog ko mne na pechku loh JA na mefedrone s vodkoj s vodkoj Zapivaju tranki buhlom Mam ja dolzhen byt' myortvym myortvym A chto mne eszyo ostaetsja JA na mefedrone s vodkoj s vodkoj Zapivaju tranki buhlom Mam ja dolzhen byt' myortvym myortvym A chto mne eszyo ostaetsja Samyj grustnyj slovno Lyoha EHldzhej Netu deneg i net druzej JA hodil vchera v EHrmitazhmuzej tam visit Van Gog  byvaet veselej Provozhu vremja kogda hozhu s bljadjami Zavisaju i p'ju alkogol' na jame Inogda YammyYammy slovno by mishka Pokupaju sebe chekovuju sberknizhku u bomzhej ehj So mnoj vmeste molchalivyj Dzhej On nikogda menja ne vydast Vse moi stroki  veganskaja picca Slushaj davaj veselit'sja davaj s toboj ebat'sja pod treki Karla Marksa Je je ja ljublju kogda sladko ja ljublju kogda so mnoj mulatka Mulatka Ol'ga mulatka Sabrina mulatka ja znaju chto ehto imja Ty vydumala tol'ko chtob so mnoj ebat'sja JA ljublju ebat' tak zhe svoih pacov Pacy iz Antihajpa Pacy iz Antihajpa Ty znaesh' chto nash gorod  ehto Hajfa My vse zhidy no my otdyhaem Zapivaju buhlom Mam ja dolzhen byt' myortvym A chto mne eszyo ostaetsja JA na mefedrone s vodkoj s vodkoj Zapivaju tranki buhlom Mam ja dolzhen byt' myortvym myortvym A chto mne eszyo ostaetsja Prrr EHto Oleg Majami
57,Po tu storonu javi i sna Geroj rodilsja vosparil  Demonom  Ne so zla propuskal yezzje Beskonechnoe koleso Sansary Grjaz' pesok botinok otca Vinovat geroj pererodilsja navsegda Kak Atlant chistyj i svezhij  EHto ja i ty ehto ja i ty nashe begstvo iz raja EHto ja i ty ehto ja i ty osudit' bez nakazanija EHto ja i ty ehto ja i ty slovno deti vse mozhno EHto ja i ty topim v prudu dyrjavoe proshloe  Krasivaja zhizn' fil'm Federiko Fellini Real'nost' ulicy pokroshit zuby b'et vo hrebet Mazhor zajdi za garazhi stanesh' inakim otnyne V Rossii zakony strannee dazhe chem  Pokuda solnca ne vidno no posered' ehtih linij Pod#ezd hruszovyj  roditel' a junyj voin  kadet Daby ne  gidom na mode byt' stil'nym Na razboj radi  pojdet i ne v Second hand  asket  EHto ja i ty ehto ja i ty ehto ja i ty nashe begstvo iz raja geroj EHto ja i ty ehto ja i ty osudit' bez nakazanija bogach EHto ja i ty ehto ja i ty slovno deti vse mozhno bednjak EHto ja i ty topim v prudu dyrjavoe proshloe  Zovi menja Boris Grojs Martin Hajdegger Sasha Pjatigorskij na huju vertel vremja JA ne s vami ja ubezhal Potrebljaj i carstvuj slava bomzham Zovi menja Din Kunc Ajzek Azimov Robert Hajnlajn ubiejnnyj Hirosimoj Vazhnaja persona massovoj ljubvi Ne najti v WikiLeaks  Ajtmatov CHingiz  JA i ty ehto ja i ty ehto ja i ty nashe begstvo iz raja geroj EHto ja i ty ehto ja i ty osudit' bez nakazanija bogach EHto ja i ty ehto ja i ty slovno deti vse mozhno bednjak EHto ja i ty topim v prudu dyrjavoe proshloe  Po tu storonu javi i sna Geroj rodilsja vosparil  Demonom mnogo ja naskvoz'  Ne so zla propuskal yezzje Beskonechnoe koleso Sansary Grjaz' pesok botinok otca Vinovat geroj pererodilsja navsegda Kak Atlant chistyj i svezhij
58,Molodost'  ne zhizn' Starost'  ne radost' Na polnuju gaz CHto eszyo tut ostalos'  JA Young Adult da molodoj vzroslyj Na rajone zhyostkom v 90h vzros ja Molodoj vzroslyj molodoj vzroslyj Novyj Majakovskij moj art  Okna ROSTA Budu koptit' nebosvod poka pozvolit mne Bog No ja zabyl koechto ja ateist znachit vechno zhivoj  Vechno molodoj vechno trezvyj Dlja odnih genij drugim bezdar' Na hejt bespoleznyj sral s BigBena sverhu Gulliverberkut sypjatsja shishki karkajut ehu Privet moim russkim i chechencam JA iz Azii Srednej ja chestnyj JA iz samyh nizov i naverh ne hotel by Vsadjat v spinu nozh gorelicemery  Sosed umer ot gery vernuvshis' iz Afgana Kostja spi spokojno kak i tvoja mama JA pomnju vseh kto ushyol nespravedlivo rano Moyo serdce  odna nezazhivshaja rana  JA Young Adult da molodoj vzroslyj Na rajone zhyostkom v 90h vzros ja Molodoj vzroslyj molodoj vzroslyj Novyj Majakovskij moj art  Okna ROSTA  Mne bylo tjazhelovato muzon moj ne zamechali Pomnju na al'bome Rep Gad ne bylo i sotni lajkov CHetyre goda raboty vpustuju kak budto by kara No ja ne ehtogo radi tut ja radi ugara Molodoj potomu chto nahuj proshlye zaslugi Vzroslyj potomu chto ja korol' i mne ne nuzhny slugi JUnyj potomu chto sohranjaju v sebe tot ogon' Starec iduszij k reke ja oszuszaju mira bol'  Young Adult da molodoj vzroslyj Na rajone zhyostkom v 90h vzros ja Molodoj vzroslyj molodoj vzroslyj Novyj Majakovskij moj art  Okna ROSTA Budu koptit' nebosvod poka pozvolit mne Bog No ja zabyl koechto ja ateist znachit vechno zhivoj
59,JA Aborigen jaja Aborigen jaja Aborigen Tam gde A potom B EH JA Aborigen jaja Aborigen jaja Aborigen Tam gde A potom B EH JA Aborigen jaja Aborigen jaja Aborigen Tam gde A potom B EH JA Aborigen jaja Aborigen jaja Aborigen Tam gde A potom B EH  Neperedavaemaja igra jazyka Neperedavaemaja igra jazyka Neperedavaemaja igra jazyka Neperedavaemaja igra jazyka Neperedavaemaja igra jazyka Neperedavaemaja igra jazyka Neperedavaemaja igra jazyka Neperedavaemaja igra jazyka  JA Aborigen jaja Aborigen jaja Aborigen Tam gde A potom B EH JA Aborigen jaja Aborigen jaja Aborigen Tam gde A potom B EH JA Aborigen jaja Aborigen jaja Aborigen Tam gde A potom B EH JA Aborigen jaja Aborigen jaja Aborigen Tam gde A potom B EH  JA Aborigen
60,Alisa ja tebja uznaju Ne po prichyoske ne po plat'ju Linii chyotkie dazhe s godami Solncem vzojdut i rastajut Alisa zharkim dnyom briz Sokrovennaja vera i orgazm Tot ottenok palitry i skazok CHerez tverdi zemli ty moj priz  Kosmicheskaja devochka konechno problemnaja Ambicii do potolka nervy na predele JA otlichalsja revnost'ju s pjatnadcatiletnego Vozrasta eju obladat' lozungu byl veren V tot samyj vecher ja smotrel televizor Nevzorova Togda ego koni eszyo mne kazalis' predvestnikom CHegoto takogo chto ej prjam s poroga pozvolilo Skazat' chto ebyot eyo hach na kupemersedese  Alisa ja tebja uznaju Ne po prichyoske ne po plat'ju Linii chyotkie dazhe s godami Solncem vzojdut i rastajut Alisa zharkim dnyom briz Sokrovennaja vera i orgazm Tot ottenok palitry i skazok CHerez tverdi zemli ty moj priz  JA govoril chto ne stoit ej k nemu idti CHto ne zaplatit za neyo skol'ko togo stoit Ona mne otvechala Poshyol nahuj kretin I govorila govorila govorila krov'ju JA by ne stal eyo bit' v zdravom razume no ved' tut Sovsem drugie sostojanija vas opravdajut Druz'ja uveszevali pomnitsja ne pustit' po miru Svobodu sostojanie eyo raschlenjaja  Alisa ja tebja uznaju Ne po prichyoske ne po plat'ju Linii chyotkie dazhe s godami Solncem vzojdut i rastajut Alisa zharkim dnyom briz Sokrovennaja vera i orgazm Tot ottenok palitry i skazok CHerez tverdi zemli ty moj priz  Alisa Alisa Alisa
61,Ugu vsegda ne protiv na vesu ne nalivat' Ty znaesh' vot ehto vsyo plastikovye stakany Pacany na rajone Andrej Salo Misha Dzhigli je  Izhe esi rodnoj alkogol' Ne bojus' uzh ne MC Molodoj B'yosh' butylki lbom Dumaj golovoj Snaruzhi tvyordyj a vnutri  kak kannoli Izhe esi rodnoj alkogol' Ne bojus' uzh ne MC Molodoj B'yosh' butylki lbom Dumaj golovoj Snaruzhi tvyordyj a vnutri  kak kannoli  Zaprygivaj v moyo ty zhidkoe kanoeh Sytym budesh' vsegda ved' tut mnozhestvo kalorij Syrym nikto ne ujdyot obogreem s ljubov'ju Razlivaj pod stolikom kon'jachok ili Moët Pej Nas ne vychislit poehtishka Somerset Moehm Moehm Ved' my v ehtom kafe kruassan vzjali i kofe My na naberezhnoj Kruazet v padike topim Svoyo gor'koe schast'e chto zhivy i ne bole Alyo Proletaem v behhe mimo nas Sobolev Kolja Saljut V nashej kole bol'she viski chem pidorov v hore Nahuj diski  cifrovye  p'yom u monitora Dzyn' Rjadom gruppa VHORE i Borisova Olja Ne delim na nolik umnozhaem na odin Koli ty buhoj to uvazhaju narrativ Da byvaem protivnye ne pri suprotiv Proebali mobil'nye da i huj na nih  Izhe esi rodnoj alkogol' Ne bojus' uzh ne MC Molodoj B'yosh' butylki lbom Dumaj golovoj Snaruzhi tvyordyj a vnutri  kak kannoli Izhe esi rodnoj alkogol' Ne bojus' uzh ne MC Molodoj B'yosh' butylki lbom Dumaj golovoj Snaruzhi tvyordyj a vnutri  kak kannoli  K chemu Maradona esli litrbol Kokain dlja bogatyh nam  alkogol' Lakiruem blevotinoj tvoj prazdnichnyj stol Ne ljubish' zhidkosti Suka beri spirt suhoj v rot  Prygal s pirsa buhoj v more v reku Dorian Grej ja Egor Letov Mozg  kak lego dolgaja leta JA vash prorok Bog Kaleka  Izhe esi rodnoj alkogol' Ne bojus' uzh ne MC Molodoj B'yosh' butylki lbom Dumaj golovoj Snaruzhi tvyordyj a vnutri  kak kanolli Izhe esi rodnoj alkogol' Ne bojus' uzh ne MC Molodoj B'yosh' butylki lbom Dumaj golovoj Snaruzhi tvyordyj a vnutri  kak kanolli
62,My kuda djadja  V zakoldovannyj gorod A zachem   Alladin tebe odnomu suzhdeno proniknut' tuda otkuda ne vozvraszalsja ni odin smertnyj  Dve tysjachi desjatyj god i vbrod perehod moj s gory do gor  smenil idejnyj most FrunzeLeningrad kak iz  Spustja veka  moj rok znaj  myorzlaja zemlja Blizhe k kornjam sehmpl kik i bass ehlit Russkij stil' ja pank JA dan vam piki gromit' v krovi Dvazhdy revoljucionnyj rodnik hot' i ne Mobi Dik Vozvraszajas' vozvraszajus' zhirnyj rehp Mobb Deep Nikomu nahuj ne nuzhen mimanonim Polunagim da po luzham pojdu ne odin  Alladin So mnoju armija l'din v serdcah proletar gimn  arcah  solnechnyj gorod gorodsolnca  Rodom iz hanstva kak Kant  No brat iz Kalika  Kant EHmmanuil Vitorgan JA Krepkoe slovo chto vystrel  menestrel' Svoloch' koli sovest' vysral  vyjdi ne cherez dveri Na lbu tatu  chislo zverja Bruttu tut chistuju veroj Spravedlivost' my vyrezhem da vyrvem bljadov'i per'ja  Hranitsja staraja mednaja lampa povtori  Staraja mednaja lampa Ty prinesyosh' eyo mne i tvoja zhelanija ispolnjatsja
63,Tol'ko posmotri na nih Oni podnimajut detej chtoby te uvideli ego Pojut radujutsja Esli sejchas on vojdyot v hram u kogo budet vlast' U tebja ili u nego  Pravdy net v nogah ona est' mezhdu Huj sisteme vydam kolom chto les ruk Na koncert  i vjalyj antrakt Totalitarnaja muzyka  Hussejn Obama Barak I tut ebut v rot kazhdogo kto alkaet babla Tut slepovatye tyolochki budto Fanni Kaplan Boga nimfy i na zavtrak tol'ko hleb i voda Vatnyj swag redkij seks ehto i est' andergraund brat Prihodi k nam pozdno noch'ju poka solnce ne vstalo My zharim na skovorode Rustama Solnceva salo Butylki plavim nam nravitsja zhzhyonyj zapah plastmass Aristokratija duha huli bljat'  Graf Galifaks I dazhe esli zahochesh' zapah ne vyvetrit' duri My glubzhe v ehtoj kloake dazhe chem myrk i baule Nabedokurit rehp kuri ohueet strana U nas tut den' za dva pej do dna gej ili pan Tachki  lifan i na shee pizdatyj gimnast Sumasshedshie vyhodki ja kak Ivan Gamaz Na pomine lyogok hriplyj kak Billi Novik No ne voruju ehti flou moi kak stili boga Ty Billi Kogan lysyj nichtozhnyj ehmsi Na rasstojanii slyshu kirgizov Huj sosi Kak govorili u nas na rajone Kto ty po zhizni Po krasnoj ili chyornoj dvigaesh'sja yobanyj shizik Budesh' otpizzhen ili plati nalog na kuru Na mne pal'to i kolpak i ja neebovo krut JA hehsh bola krug u menja kehsh po rublju I tak celyj million ved' ja beshenyj guk Mesto zhitel'stva  les i komp'en vagon Moja tradicija  pen' gabon Krasnyj khmer i opasnye mery v rot ebat' Ot odnogo pancha pogibnut pjat' rot kotjat Niszeta tut pravit balom tridcat' shest' chasov v sutki JA dazhe kogda ulybajus' neebovo nasuplen Na hejt kak Voloha Putin kidaju huj na progib Dve revoljucii v pjat' let i ja tut hunvejbin Biljat' ja huzhe chem ty Hotja kuda uzhe huzhe JA kushaju tvoju mamu nesu hujnju kak Horuzhij Pljus zakachaju tebe v pleer svoj rehp bratan Budesh' o pomoszi krichat'  poszady net vragam Rehp  ehto kal a znachit rehp  ehto pank Ljublju kogda podgoraet u cunarefa pukan I modnyh pridvornyh dam poroh gorit v gorodah Nam bogstarik ne ukaz ebyot v Karin moj rehpak Rasslabljus' JA slishkom mnogo skazal Eszyo odno slovo budet lishnim i vsyo mne  pizda Mne vydast s verhnej polki Viktor AKa lesza Muzon zadrygaet Galat akarykan dryszan JA pogruzhajus' v ad i tam voskliknet Vergilij Ty modnyj andergraund rehper slovno Milligan Billi Zachitaj chego iz novogo I ja zachtu Kak tjazhelo zhit' na Rusi v stile changachu Potom EHrnst  skazhet chto Frojdrehper hotel mamu ebat' teper' srok svetit JA ispugajus' i broshu torgovat' tuzom Stanet pizdec kak grustnym andergraund porusski I huj s nim
64,Nu eszyo ne hochu ja v shkole uchitsja Nafig ona mne Hochu hodit' na komp'juternye kursy  Rasskazhi Andrej kak tebe tjazhelo zhilos' Rasskazhi im vsem kakovo byt' tvoej zhenoj Pochemu ty za ehtim stolom nezvanyj gost' ZHaloba eszyo pro to kak ty im v gorle kost'  Gorlinka gulit no ja vsyo vizhu golubok Vse tvoi priyomy podkatyvaet k gorlu kom Mozhesh' ne proiznosit' znaju frazy bez slov Mnogo ty nasochinjal skazochnyj ebobo Polozhil bolt na ves' hiphop I ves' hiphop polozhil bolt Na tebja loh tvoj vyebon Predskazuemej chem Solov'yov  Rasskazhi Andrej kak tebe tjazhelo zhilos' Rasskazhi im vsem kakovo byt' tvoej zhenoj Pochemu ty za ehtim stolom nezvanyj gost' ZHaloba eszyo pro to kak ty im v gorle kost'  Andrej Andrej Andrej Andrej  Andrej kak dela Kak tvoja golova Udalil Instagram Kak zhe ty zaebal Peredavaj salam nashim vsem pacanam Pomnish' ih nomera Hotja b pomnish' ih imena Nu tak oni i sami ne idut na kontakt JA tak chasto onlajn Fejsbuk Kontakt I dazhe kogda poslednij raz priezzhal Ochen' dazhe pogovorili my po dusham  Rasskazhi Andrej kak tebe tjazhelo zhilos' Rasskazhi im vsem kakovo byt' tvoej zhenoj Pochemu ty za ehtim stolom nezvanyj gost' ZHaloba eszyo pro to kak ty im v gorle kost'  Andrej Andrej Andrej Andrej Andrej Andrej Andrej Andrej Andrej Andrej Andrej Andrej Andrej Andrej EHj je  Rasskazhu im vsem kak zaebato ja zhivu CHyo hochu v svoyom hiphope to i vorochu Esli vozzhelaju  politikom vorochus' CHtoby dolboyoba vzjal jadernyj Karachun Rasskazhu im vsem kak zaebato ja zhivu CHyo hochu v svoyom hiphope to i vorochu Esli vozzhelaju politikom vorochus' CHtoby dolboyoba vzjal jadernyj Karachun  Andrej Andrej Andrej Andrej JA Andrej ja Andrej JA Andrej ja Andrej ja Uragan Andrej
65,Jou Russkij rehp toski lishilsja No lohi teper' skuljat i pljashut v skinny dzhinsah A my kak vsegda ebashim pod seljami Jou stil'  ne bestseller on dlja teh kto cenit  Antihajp Antihajp vibration  Nam poebat' na tvoj respekt pohuj Nam pohuju na tvoj repost pohuj Ved' nashe mesto  minus pervyj u u V ehtoj gniloj kogorte zvyozd che Da ehto ocherednoj nelepyj boj Za slovo tru nam iz podvala vidnee Lepit hujnju ocherednoj nelepyj boy My lepim gorbatogo i  Skazhi mne chto takoe hajp Gde zaryt zavetnyj klad My rifmuem na veka Ne dlja pablikov VK Zapuskaju v nebo kajt Ty ne putaj berega EHto u vas tam v kabare i postavlennyj kankan V teme 12 let nravitsja byt' protiv Pohuj na put' v topy  tam rehpery v kolgotah Dlja nih ja kak pankota Kosoj za pjatak plotnyj JA budto by v Dakote no ne bylo perelyota Raznyj kul'turnyj plast JAsno ty ne sechyosh' Majti zamutit bas i ty vrjad li tak zachtyosh' JA v poiskah novyh bars ty postish' svezhij mem Dlja tebja talant  Galat u menja tam Method Man Nu chyo ty ponjal prajs  motivacija i kajf Na koncertah u Mirona nashi v majkah Antihajp I pohuj na resurs post ved' nichyo ne znachit Esli u vas vkus huyovyj  Mihail Pan'shin  My prostebali vsyo chto ty schital ser'eznym rehpom Dlja ehtoj Rechi Pospolitoj ja  Verhovnyj Getman U tebja v pleere Devlin u menja Method i Redman Radi panchlajna spizdel Slushaju mistera Kredo A ty zadissil sam sebja hejtom Samojlova Gleba Davis' teper' bubalehom kubiki pressa kak lego Net ja rahitnyj chempion i ugaraju po veganu Hotel by byt' uzbekom i vdovol' toptat' Ferganu Pod zemlej kak topinambur  naskol'ko my ljutyj andr Nastol'ko zhe my prodazhnyj Bezdushnyj tovar dlja ssanyh vkontaktovskih marginalov Antihajp na veka JA hochu chtob vy zhelali mne smerti kak nikogda Svoj belyj klej PVA l'ju pod gubu ehtim legendam Tupaja pizda muzhik ty Angela Merkel' My rezhem slabyh slovno bandy v Bishkeke Osvencim otkryt zhidok my angely smerti  Nam poebat' na tvoj respekt pohuj Nam pohuju na tvoj repost pohuj Ved' nashe mesto  minus pervyj u u V ehtoj gniloj kogorte zvyozd che Da ehto ocherednoj nelepyj boj Za slovo tru nam iz podvala vidnee Lepit hujnju ocherednoj nelepyj boy My lepim gorbatogo i zhirnyh lepim  V offlajne pro vas ne znajut Vasha sranaja igra  deshevyj fars i ikra lish' Vitruvianskij chelovek na virtual'nom ehkrane Drochish' chetyr'mja rukami Tol'ko sram prosypaesh' Tut tusa Antihajp vidja idja obtekaj Slushal Nojza EHmsi pozavchera  ja tikal Plavaesh' gluboko tol'ko v anal'nyh glubinah Topovaja akula rehpa iz mjasa surimi JA videl kakto po rajonu begal malen'kij Drejk Tipa Trehvis Skott dlja niszih palyonyj Tori Lehjnz S imenem zhenskim v plat'e no tochno ne junyj bandit Pod avtotjunom kak p'janyj  hohma i jumor odin A ja na treke s kumirami Zoo Majti Loko Na nas prostaja odyozha hotja i mantij mnogo Slava tut a ty ne proslavivshis' oslavilsja chyort Malaja raznica no vazhen smysl chto mezhdu strok you know  Loko Ktoto pomnit ne odnu ehpohu v ehtoj porvannoj naskvoz' igre I esli b mne bylo ne pohuj na tvoih nelepyh homie Na retvity i reposty JA davno by brosil vsyo shagnul v proyom okonnyj k zvyozdam Bros' ih Oni sotrjasajut vozduh no uzhe ne dyshat My vgryzaemsja im v kosti podzhigaem hizhiny ih Podtiraemsja ih posterami i afishami Russkij podzemnyj hap ispyoksja  ne ne slyshal nene slyshal Unichtozh' svoi EPshki vykin' vse mikstejpy My s bratishkami ebali prjamo v zhizhku tebja Mamin vejper papin hejter U menja net flehjvy Znaj lish' brat'ja po oruzhiju Mozhesh' ostavit' sebe svoj dyrjavyj hajp My ne ostavim tebe slushatelej  Ty ih ne zasluzhivaesh'  Nam poebat' na tvoj respekt pohuj Nam pohuju na tvoj repost pohuj Ved' nashe mesto  minus pervyj V ehtoj gniloj kogorte zvyozd Da ehto ocherednoj nelepyj boj Za slovo tru nam iz podvala vidnee Lepit hujnju ocherednoj nelepyj boy My lepim gorbatogo i zhirnyh lepim
