,lyrics
211,Trofej snezhnogo barana osobyj predmet gordosti kazhdogo gornogo ohotnika Dobyt' takoj trofej  nastojaszee ispytanie voli sily i masterstva  JA na ohote kazhdyj moj bozhij den' Vsegda Iszu chto by tak spizdit' paren' Nuka Ne dogadalsja chtob olen' Nikogda I tak chtoby podorozhe vparit' Mne nuzhny milliony Mne Mne nuzhny medal'ony te Te CHto sijajut jarche belyh nochej i rabskaja cep' Daj mne My klejmim poroki obszestva Zovi nas kollektivnyj Dud' JUra I v cifre skol'ko zarabotal poschitaem kazhdyj nul' Kak vsegda Vot tut kuda ushla desjatka Kuda Vot tut zachem novyj ajfon Zachem Tvoj staryj takto esze nichego Ne vedi sebja kak korol' Ty kto Ty zhe bomzh seesh' lozh' Aga Naebyosh'prozhivyosh' Vsegda Pohudel budto vosh' EHto ty JA possu  ty dop'yosh' Nu kak Ty horosh ty lovkach Aga V instagrame million Ogo A ja zaviduju ved' ne ebat' mne ehtih maramoek Uvy  JA mozhet slishkom old skul Vsegda Vo mne est' kapel'ka pravdy Ne vtiraju mify v desnu Nikogda I ne polagajus' na travku JA rublju golovy s plech Shotshotshot Moj zhidkij mech budto by plet' Ratatata JA vysekaju iskry no tvoja zhopa EHto to chto budet goret' Uyobok  Ohota ohota ohota terrora Povesit' golov pobol'she na zaborah Ohota ohota ohota byt' Bogom Sudit' i karat' ja vsyo vizhu kak Oko Ohota ohota ohota terrora Povesit' golov pobol'she na zaborah Ohota ohota ohota byt' Bogom Sudit' i karat' ja vsyo vizhu kak Oko  Vyeb goroda i zarabotal deneg U Nynche zhopu moej damy vozit Merin U Dumal Morgenshtern Naebal Naebal suka JA daun podpishis' na kanal Nahuj n'juskul takzhe nahuj oldskul Pidoras na pidorase vechno parjat hujnju Pososite moj huj i idite na huj JA ne budu dazhe radi vas iskat' rifmu Ne budu bljat' U menja byla smeshnaja perepiska s Morgenshternom Blja budu V perepiske on priznal chlen Fehjsa potrepal vsem nervy Seksual'naja Mar'jana chlenom sil'no nedovol'na Real'no EHtot burger ni o chem Bol'she bylo razgovorov Pizdec blja  Uuuuu Alisher primi kak dannost' real'no Alisher blja Ty ebanaja bezdarnost' Blja budu otvechaju nahuj Uuuuu Ne pomogut nikakie u Alisher poshyol v pizdu  Uuuuu Bez obid blja Uuuuu Sosi moj huj blja ne moja vina Uuuuu Poshyol v pizdu ja ne vinovat Uuuuuuuu Privet Merzagulovu i dedu myortvomu  Po vsem hejteram yopta popadaju metko EHto ne redko EHto moja konfetka N'ju skul  ehto tabletka bljat' eszyo raz Po vsem hejteram popadaju metko EHto ne redko EHto moja konfetka N'ju skul  ehto tabletka bljat'  Esli ktoto iz vas pizdit chto Baby Big Baby ehtot huj  hujnja to vy ne znaete on sosal huj konja Vy na takoe bljat' ne sposobny vam takoe ne ponjat' yobanye nichtozhestva  Ohota ohota ohota terrora Povesit' golov pobol'she na zaborah Ohota ohota ohota byt' Bogom Sudit' i karat' ja vsyo vizhu kak Oko  Ohota ohota ohota terrora Povesit' golov pobol'she na zaborah Ohota ohota ohota byt' Bogom Sudit' i karat' ja vsyo vizhu kak Oko
212,JA zdorovyj pacan mogu sdelat' udarpryzhok No v armiju ne vzjali skazali slishkom hitrozhop I ja mogu udarom v golovu s nogi ubit' losja No oruzhie davat' takim kak ja vidite li nel'zja Nadezhdy potuhli ja ne hochu gnit' na kuhne Pered tem kak vyshvyrnut' menja krichal Vy chyo opuhli padly Armija v ochke i vam nuzhny takie kadry I ehtot mir bez kalasha ne sahar nu i ladno Na moem rajone zhest' battlrehp shit Vojny klanov rehpery battljatsja i drug na druga bychat poluchajut leszej Samyj derzkij rifmoplet hudoj kak koszej k tomu zhe vechno pod spajsami JA pizdec vzvinchen davaj pobattlimsja ty pod avtotjunom ja pod pitchem Kto pobedil Pust' reshaet sud Lincha mne pohuj ja v rehpe kak tank na battle kak na vojne No chtoto poshlo ne tak za avtotjun golosuet kazhdyj mudak a ih tam kazhdyj pervyj Vam by vsem po oszipat' by per'ja no kury i tak ne vzletajut vyshe plintusa Tol'ko i slyshno snizu kokoko kokoko i inogda kukarek EHto ne zvezdopad ehto parad kalek parad kalek  Takogo zrelisza ne vidoval russkij narod vo vek po central'noj ploszadi shestvuet parad kalek Vstavljajut palki drug drugu v kolyosa slyshno ston i hrip EHto oni vzbirajutsja kto kak mozhet na rehpolimp Takogo zrelisza ne vidoval russkij narod vo vek po central'noj ploszadi shestvuet parad kalek Vstavljajut palki drug drugu v kolyosa slyshno ston i hrip EHto oni vzbirajutsja kto kak mozhet na rehpolimp  JA vo glave ehtogo sbroda kalek I ja vedu ves' russkij rehp na huj uzhe sorok let I po puti ne odin mc uzh rakom zabolel I popadi s nami polzyot i rakom DECL I master shefa Brick Bazuka dazhe Grjaznyj Lui Net by ispit' vina no te menjajut vas na rubli Ssanye rifmy polirujut kak probor DzhonniBoj Kakto vidal Battlmc dazhe porolis' v ochko No mne ne strashno esli chto allah podarit lesza I moja rehp kar'era prygnet vverh kak sranyj gimnast JA zavedu lejbl na lejbl ja bljadej zavedu Budu pivat' tol'ko blehk lejbl i detej zaebu Rehpom pro razvrat i porok pro to kak vseh v rot ebu Pro to kak vseh v rot ebu pro to kak vseh v rot ebu Pro to kak vseh v rot ebu babu jagu i abu Kol' ne sotru jazyk a zhopy na jazyk mne tipun Ljudmilu Zykinu na hukah cherez pustynju vedu EHtu bezlikuju shoblu no ja ljublju ehto tru Moyo gehngsta v tom chto ja chestnyj russkij rehperloshok Na treke Mastavoj Zamaj KPSS MF Dok Vot  JA kinu okurok vinstona nakinuv v kurtku vejp Napleval vam v harizmu i ujdu kak Kurt Kobejn Proebal Posola gladkostvolnogo na behkah sosa I sdelav kambek uvizhu vse sosut kak i sosali Mne nuzhen Susanin v debrjah rifmy panchi V mire gde bljat' car' mif vse rybachit i rybachit Brat chyo Est' pochitat' chyo iz dabltajma gde na hukah bezgolosyj a pizda boltaet Gde zhertvy kidneppinga zanimajutsja nejmdproppingom Na versusah dlja vas odin panch v metro pinkom Naa Sdelaju bloknot iz negrov v Novyj God Rebrending NPansa  negronomikon V tvoih krasnyh glazah ne vidno razuma rehp pizdostradal'cev ehto vid odnorazovyh vid pidorasovyh U vas parad kalek tam ja poslushal tvoe demo bro tebe pora v kollektor  Takogo zrelisza ne vidoval russkij narod vo vek po central'noj ploszadi shestvuet parad kalek Vstavljajut palki drug drugu v kolyosa slyshno ston i hrip EHto oni vzbirajutsja kto kak mozhet na rehpolimp Takogo zrelisza ne vidoval russkij narod vo vek po central'noj ploszadi shestvuet parad kalek Vstavljajut palki drug drugu v kolyosa slyshno ston i hrip EHto oni vzbirajutsja kto kak mozhet na rehpolimp  Nad Petrozavodskom tuchi a ves' vash rehp ebuchij MC chitaet tak kak budto ego snova puchit Ne uchi menja kak zhit'  ne poluchish' pulju Ne uchi menja kak zhit'  ja zhivu kak duju V nature ja chetka rodnaja mat' ne dast pozhrat' a golod ne tetka I ehtih negrov my lupili i lupim kak pletka znakomyj zapah tabaka ehto gorit opletka I ne lechi nam pro Nabokova chitali yopta MC chitaet nam moral' no ego zuby v skobkah U nas podpol'nyj rehpachek nas ne iszi na polkah takoj podpol'nyj rehpachok ego najdut v raskopkah I fantasticheskij progress vse ta zhe naebka ved' ehto dvizhetsja voda no ne dvizhetsja lodka vot kak I mne byvaet stydno kogda beru kartoshku fri a moj sous ne syrnyj Moj monitor  okoshko v mir Naval'nyjDemidov u menja pod oknom prohodit parad invalidov Lida daj mne ljubvi v rassrochku pust' ne daril ja roz no rozochka rezhet sorochku Net tochno nado dat' urok synochku on nachitalsja Diogena i delaet bochku Dat' urok synochku on nachitalsja Diogena i delaet bochku
213,Vse vashi ponty ebuchie pro buhlo i narkotiki Kidaete kak babki svoi psevdo pontiki Vash metod maksimum ehto s pudroj ponchiki Mudrecy zatorchali pososut za panchlajny Mne tak Blevotno ot takih povorotov bljat' Ne udivlen pristup rvoty vashe pizdabol'stvo prosto vat Smotri bratok Tvoj Stilek podtek Teper' on prostovat EHto Pravda ja podrostok ty byl tihonja ne prodazhnyj No krizis nastupil i ty rezko izvinilsja pered vsemi S vitrin produkt kretin ty uzhe gotov kupit' Vse Vy zhertvy marketinga ehto mozgov blickrig JA uzhe Gotov sejchas provesti vam rehp lekciju Zaletaju prjam na RiP tam popsa postjat teh kto otsosal Nikto ne slyshit ehtot krik ved' tak oret zamaj Prinimaet v antihajp v zdanii svezhaja krov' Sej sezon dlja vas poslednij bro antihajpu vy ne rovnja
214,Zamaj ty ebanulsja sovsem uzheaSkol'ko mozhno vyyobyvat'sja Hahaha da beskonechno mozhno vyyobyvat'sja potomu chto vsyo po suti vsyo tak  Salam Ty uzhe v hlam A ja uzhe sverhSHerhan S togo sveta vosstal kak Asad Bashar Tvoj ashram  podval Nasad i Mark SHagal Ne dam pjat' tebe shaha Ty ne tigr  shakal Zamaj Han zdes'  pohuj vsyo Ty  Iisus Hristos ja  Bog usyok Slyshu teksty pesen tvoi  lapsha Vizhu tvoih keksov  shantrapa Bezhish' marafon no nautyok Kak Roman Volobuev  voloyob Ty Anton Komolov ne SHandar Dobrjak bezdarnyj  klashar  A ja paren' plohoj da ja  paren' plohoj I ja musor v tvoyom mire kak JUra Hoj Budu paren' plohoj vsegda paren' plohoj Ved' upyortyj uporotyj sranyj hohol A ja paren' plohoj da ja  paren' plohoj Mne ne len' trahat' ves' ehtot bljadskij hiphop Budu paren' plohoj vsegda paren' plohoj I puskat' puzyri dazhe v adskij kotyol suka Plohoj paren'  ehto ja plohoj paren'  ehto ty Plohoj paren'  ehto tot kto vertit na elde ves' mir Plohoj paren'  ehto ty plohoj paren'  ehto ja Plohoj paren' stancuet u hejtera na pohoronah  Mne bylo trudno nachat' Teper' ja  krupnyj nachal'nik Uvol'njaju s bita vseh ehtih trutnej pechal'nyh Vse ih panchi  ne puli a krugi po vode Tam u hiphopa ja vchera pridelal huev novodel I ja kogdato byl horoshij ne bil panchlajnami po rozhe Hodil po pravilam i kajus' byl unylej chem kon' BoDzhek No teper' ja razozlilsja i ustraivaju ad Ty possal malyshkam v kodein lish' pjat' minut nazad  A ja paren' plohoj da ja  paren' plohoj I ja musor v tvoyom mire kak JUra Hoj Budu paren' plohoj vsegda paren' plohoj Ved' upyortyj uporotyj sranyj hohol A ja paren' plohoj da ja  paren' plohoj Mne ne len' trahat' ves' ehtot bljadskij hiphop Budu paren' plohoj vsegda paren' plohoj I puskat' puzyri dazhe v adskij kotyol suka Plohoj paren'  ehto ja plohoj paren'  ehto ty Plohoj paren'  ehto tot kto vertit na elde ves' mir Plohoj paren'  ehto ty plohoj paren'  ehto ja Plohoj paren' stancuet u hejtera na pohoronah
215,Probudis' kak Gautama ubedis' v tebe est' prana Ne gasis' ot istiny na sutru nanizany mysli Te chto unesut v Nirvanu Posle fenika vse stalo strannym V kolonkah Karlos Santana basit kak Satana Nesus' sapsanom k nebesam a sam cveta blednyh poganok Zamknutyj v sebe kapkan sposoben lish' bezzubo klacat' Ob ehtoj samosti svoej pokalechennoj cheljust'ju Kak poluchilos' v cheloveke netu chelovechnosti Zastrjavshij v vechnosti poterjannyj v tryoh sosnah mysli Vjalo taszu konechnosti kak za flejtistom krysy Iz ehtoj kazhuszejsja kletki k nezrimoj cerkvi Pauk ustal krutit'sja v banke i udarom v centner Brosilsja vsem telom v oskolkah i pyli uzrel on Za gran'ju banki tol'ko banka chut' bol'shih razmerov Kuda hotel on a Opjat' polzti bez dela Pauk v sebe vsecelo i kuda ni gljan'  vezde on  V ehtoj banke nikogo krome pauka Dvigaj lapki v nikuda tol'ko pustota Po oboim storonam ehtogo glupogo sna Takogo glupogo sna V ehtoj banke nikogo krome pauka Dvigaj lapki v nikuda tol'ko pustota Po oboim storonam ehtogo glupogo sna Takogo glupogo sna  JA v Instagrame i Tvittere raspoznal dzen Osel na dne interneta na kajf podsel I ehtoj moj ljutyj spajs moj otkrytyj space Druz'ja krichat mne Vylaz' no s ehtoj igly ne slezt' Net No ja starajus' bratok Brosit' fal'shivyj mirok kak moj tovariszgovno JA ne Marat ne Danton ne Robesp'er Mirabo JA lish' vojuju s jazykom budto mne tekst ne rodnoj Starajus' prosto vyjti za granicy smysla Poka bessmyslennyj zhelaet za granicu smyt'sja Moja strana i tak menja brosila chto uzh bole Moja istorija brosila golovoju v pole No ja dovolen epta Na sud'bu ne greshu JA v rifmovke robkij bezumnyj Ashu Moj podveshennyj jazyk kak na nitjah pauk SHestnadcat' strok  ehto banka no ja vyhod najdu Tut  V ehtoj banke nikogo krome pauka Dvigaj lapki v nikuda tol'ko pustota Po oboim storonam ehtogo glupogo sna Takogo glupogo sna V ehtoj banke nikogo krome pauka Dvigaj lapki v nikuda tol'ko pustota Po oboim storonam ehtogo glupogo sna Takogo glupogo sna  V kotorom ja sizhu za steklom i muchu hiphapy Mne otorvali moi dlinnye chudnye lapy Vse krome odnoj ura i tu chto ostalas' Samozabvenno makaju v tush' EHto radost' Kogda ja vyvozhu zatejlivyj uzor iz bukv Poka vse spjat zanoshu obratno sor v izbu Moja pautina podle menja ja popal v nee sam Doroga kratna ne santimetram net a nedeljam dnjam i chasam Vkljuchiv neukljuzhij galop na edinstvennoj lapke skachu po kletke tetradnoj Vremja ot vremeni razdaetsja moe djuzhee gop Soprovozhdajuszee popytki pereprygnut' ehti dekady Naskol'ko hvataet moih vos'mi glaz V obe storony splosh' petli peremychki Muhi b'jutsja i zhuzhzhat mol voz'mi nas Vse my neponjatno dlja chego zdes' vse my goremychnye Absoljutno vse No ploh tot mechtatel' ch'ja mechta sbylas' I tot kto promenjal kloch'ja oblakov na gorst' zemli Ili svobodu promenjal na vlast' JA spal i byl uveren chto tochno ne takov Vse tak ili inache tjanetsja nitjami iz menja I net veszej chto ja ne silah byl by izmenjat' Povremenju umirat' budu i dal'she pit' zhizni jad Son byl takim produmannym chto sam soboj slozhilsja v jav'  V ehtoj banke nikogo krome pauka Dvigaj lapki v nikuda tol'ko pustota Po oboim storonam ehtogo glupogo sna Takogo glupogo sna V ehtoj banke nikogo krome pauka Dvigaj lapki v nikuda tol'ko pustota Po oboim storonam ehtogo glupogo sna Takogo glupogo sna
216,E Saljut EHto CiTy So mnoj STRiKE  Peredavaj majk peredavaj majk Andegraundzvezda  ehto ja i ja STRiKE Peredavaj majk peredavaj majk EHto SiTi moj trek kachaet na repite Peredavaj majk peredavaj majk Andegraundzvezda  ehto ja i ja STRiKE Peredavaj majk peredavaj majk EHto SiTi moj trek kachaet na repite  Sdelaj zvuk pogromche sejchas chitaet SiTi I skoro u tebja moj trek kachaet na repite Eu Snachala raz potom drugoj zatem stabil'no v pleere Aga Utyor nos vsem tem kto v menja ne verili Haha JA ne terjaju vremeni da ja vsegda v dejstvii A na tvoej kar'ere uzhe risujut krestiki CHto No ja takoj ne odin nas ochen' mnogo Dadada Znajte to chto kazhdyj v silah probit' sebe dorogu Zapomni menja skoro budesh' mnoj gordit'sja Ved' za ehtimi plechami stoit vsja stolica JA videl ehti ulicy ja videl ehti lica Takoe mnogim iz vas dazhe ne prisnitsja Aa Zdes' pacany ot bezdel'ja tusujut na rajone Ih golovam davno nuzhny novejshie geroi Takie kak SiTi takie kak STRiKE Esli ty v teme ja tebe peredaju majk  Peredavaj majk peredavaj majk Andegraundzvezda  ehto ja i ja STRiKE Peredavaj majk peredavaj majk EHto SiTi moj trek kachaet na repite Peredavaj majk peredavaj majk Andegraundzvezda  ehto ja i ja STRiKE Peredavaj majk peredavaj majk EHto SiTi moj trek kachaet na repite  V dve tysjachi tret'em delali rehp dve tysjachi desjat' Poka ty prygal po scene ja razvival k sebe vechnost' Da Peremalyval rynok vashi nadezhdy A ja rany svoi lechil ehtim rehpchikom v centre EHto vysshaja cennost'  ponimat' kto ty est' Na korolevskoe kreslo ne sel by i sidet' Deti sel'skie est' ja zhe budto Skarfejs zdes' Haha Sral na potugi lejblov pohuj koli ty hejter Ubejsja nahuj Hej man ehto SiTi i STRiKE Dva diploma na dvoih davi na pedal' Bify nahuj ne vsralis' vse pizdatye s nami Vseh pizdatyh my znaem kto ne s nami tot slabyj Prodakshn Saadu my sami tvorcy svoego stilja i tut My zdes' CHtoby vsyo sdelat' krasivo PARS Records tvoju mat' Supreme Ent Underground Mainstream porulit' ne dadim  Peredavaj majk peredavaj majk Andegraundzvezda  ehto ja i ja STRiKE Peredavaj majk peredavaj majk EHto SiTi moj trek kachaet na repite Peredavaj majk peredavaj majk Andegraundzvezda  ehto ja i ja STRiKE Peredavaj majk peredavaj majk EHto SiTi moj trek kachaet na repite Peredavaj majk peredavaj majk Andegraundzvezda  ehto ja i ja STRiKE Peredavaj majk peredavaj majk EHto SiTi moj trek kachaet na repite Peredavaj majk peredavaj majk Andegraundzvezda  ehto ja i ja STRiKE Peredavaj majk peredavaj majk EHto SiTi moj trek kachaet na repite
217,Idyot dozhd' chyo zhe eszyo skazat' Vot by mne lazer  Zaplutal zabuhal v dyrah utlyh sutan JA alkan daj mne gaz budto izobutan CHerez peski k vode  daleka moja cel' Zaplachu tysjachu cen ferma vdali kak pricel  Zaplutal zabuhal v dyrah utlyh sutan JA alkan daj mne gaz budto izobutan CHerez peski k vode  daleka moja cel' Zaplachu tysjachu cen ferma vdali kak pricel Zaplutal zabuhal v dyrah utlyh sutan JA alkan daj mne gaz budto izobutan CHerez peski k vode  daleka moja cel' Moja cel' Zaplachu tysjachu cen ferma vdali kak pricel  Zaplutal zabuhal v dyrah utlyh ja soldat JA alkan daj mne gaz budto izobutan CHerez peski k vode  daleka moja cel' Zaplachu desjat' cen sotnju cen ferma vdali kak pricel  Zaplutal zaplutal Daleka moja cel' Ferma vdali kak pricel
218,EHj dva nol' desjat' ehj EHj Zamaj  Piter AM  moja volna radiopriyomnik starovat Ni razu ne pil kofe v Starbucks Optina pustyn'  moj karman Zdes' 10 let uzhe kak da V rehp igre troll' budto StarCraft Poprobuj tron' ty moj art craft Piter AM  moja volna Piter AM  moja volna radiopriyomnik starovat Ni razu ne pil kofe v Starbucks Optina pustyn'  moj karman Zdes' 10 let uzhe kak da V rehp igre troll' budto StarCraft Poprobuj tron' ty moj art craft Piter AM  moja volna  A ja bolvan huzhe  baran soten razocharovanij  v uzhin botva Da ja  atlant i vsyo smog sam no inogda ja budto crack wanna smoke some JA horoshij chelovek ili badman EHto Marsovo pole mne vatman Zdes' menja raspishut i dazhe Vsevyshnij na nadgrobnom kamne vyb'et Talant JA ebal ehtot mir v rot poshljaki ne ukaz bro JA standartnyj pidoras no ne banal'nej Didro tak zajmu Gazprom JA ebal ehtot mir net moja muzyka  kak Min net Polna zadora ipza zaborom moja golaja zhopa veselit vseh  Plachet komik nad zagublennoj sud'boj Umer Coj i Gruppa krovi teper' stala goluboj I ego vozzren'ja krasnye kak budto by Lukojl CHyornobelyj mir kak shahmaty gde on kostjanoj korol'  Piter AM  moja volna radiopriyomnik starovat Ni razu ne pil kofe v Starbucks Optina pustyn'  moj karman Zdes' 10 let uzhe kak da V rehp igre troll' budto StarCraft Poprobuj tron' ty moj art craft Piter AM  moja volna Piter AM  moja volna radiopriyomnik starovat Ni razu ne pil kofe v Starbucks Optina pustyn'  moj karman Zdes' 10 let uzhe kak da V rehp igre troll' budto StarCraft Poprobuj tron' ty moj art craft Piter AM  moja volna
219,Moi demony  moi pokemony ja zol Na sistemu tut ne pomozhet i afobazol Alkogol' narkotiki zhensziny i battlrehp JA pojdu golosovat' i vyberu v dumu ih vseh Bidrilla v predsedateli Parasa emu v zamy Golbata chtob letal i gadil prekrasnye zaly Nu a Putina  v otdel kul'tury vo glavu Tam posmejat'sja nad nami ego zhdet uzhe Glum Golema v komitet po bjudzhetu i nalogam V komitet po transportu postavim Sloupoka V ohranu zdorov'ja nu ja ne znaju mozhet ty Prekrasnyj slushatel' samyj redkij grabit dzhinsk Vsju svoru voedino mozhet byt' veselee Stanet s pokemonami vmesto deputatov Rassei No vot tol'ko nezadacha mne ne pojmat' nikak V pricel fotokamery ajfona samogo sebja  JA sprjachus' ot mira vzroslyh i ja na vsyo gotov Kogda so mnoj sil'nye monstry sredi zhivyh slabakov Pust' v gazetah mel'kaet pyostro chto ehto obman izvne So mnoj moi dobrye monstry v bol'shoj i zloj strane  JA by tozhe hotel byt' umnej Alakazama No RPC umnikov ne ljubit kak mne pokazalos' Reshil prosto poshutit'  ne smeshno Iskanderam Policejskie dali pajal'nik  stal CHarmanderom Tret'ja ehvoljucija bandery vrag kak M'jutu Skorej by novye video iz baraka v jutub Ne to mesto vybral gde vzbirat'sja nachal na Olimp Gde v presshate rabotajut Machop i Hitmonli I vse dela reshajut u kogo pobol'she Star'ju i Starmi Polgoda nazad eszyo mog chuvstvovat' sebja starym Segodnja pokemonom ne udivish' kak virusom SPIDa Poprobuj v takoj masse byt' unikal'nym kak Spinda A moi druz'ja ostalis' na kryshkah mirindy Uzhe ne byl Vidlom sozreval kak Kakuna Kem vylupljus' ne znal  sjurprizkinder No videl odno bydlo imenno poehtomu dumal  JA sprjachus' ot mira vzroslyh i ja na vsyo gotov Kogda so mnoj sil'nye monstry sredi zhivyh slabakov Pust' v gazetah mel'kaet pyostro chto ehto obman izvne So mnoj moi dobrye monstry v bol'shoj i zloj strane  Dlja nas ehto tak  prikol'nyj zhyostkij krovavyj gon No gdeto v lesu holodnom prjachetsja pokemon Tam gde ne vstretish' rebyonka tam gde ne slovish' seti On brodit odin v potyomkah iszet kuda idti Poslednie sily terjaja na zapah svechej idyot A szadi podrostkov staja Shvatim ego vperyod Tebe otkrojutsja dveri v tyoplyj ujutnyj hram Ved' vse virtual'nye zveri iszut spasen'ja tam Razrusheny zlye chary svobodna tvoja dusha Ne budet Orichimaru pokemon proszaj Tovariszi Proszaj pokemon proszaj Vypuskajte svoih pokemonov  My s druz'jami limonovcy mutim modnye akcii Za svobodu pokemonov predlagaem vvesti sankcii Kazhdomu gosudarstvu chto bessovestno vvozit ih Poroj v odnom pokebole vmeszaetsja do 16 goldakov V nature mne strashno smotret' na ih bednye kosti JA slyshal menty CHarmanderu tushili hvostik v otdelenii A hitrye zhidy iz togo pod#ezda Prisposobili Blastojza pod vodosnabzhenie dachnogo uchastka I kazhdyj vtoroj pokemon v nashej otchizne ne schastliv A mne hotelos' shvatit'sja za golovu kak Psajdak Kogda ja uvidel kak ot Rajchu zapityval akkumuljator deputat Rajkin I v klipe Redo pokemongrajmer ehkspluatiruetsja kak nekoe nizshee suszestvo No my ne Katerpi i na brjuhe ne budem terpet' proizvol Odnako nash miting opjat' razgonjaet OMON I edkij dym v tolpu vypuskaet pokemon Vizing suki  JA sprjachus' ot mira vzroslyh i ja na vsyo gotov Kogda so mnoj sil'nye monstry sredi zhivyh slabakov Pust' v gazetah mel'kaet pyostro chto ehto obman izvne So mnoj moi dobrye monstry v bol'shoj i zloj strane
220,Zamaj zavodi My na sranom traktore strana pozadi Strannyj fakt no nas kak Pahoma za pogony shvatil Bratishka  nostal'gija v sportivkah s rynka skandiruet gimn EHto neobratimo kak ciklichnost' sobytij v gifkah i vajnah Pod ehtot bit bez zapivki slesarja spirt hujarjat I budto zanovo po carjam streljajut Dnja net chtoby ne sovali u barov nogami v lico S nami na majke Rotaru 100500 Bratan eszyo bratan dva bratishki Gazmanov Rebjatishki bazlajut za vsyo My dayom po gazam i znaem chto znamja vezyom Ty slyshal pozadi gromkij krik Nu vsyo ehto Milonov Vitalij Vitalij diko prostite No vashi tanki na puti vstali i byli sbity a chto so svitoj  svitery prosviry obidy pusty i protivny  pogib paladin no uvy Vseh terpil ne najti po ID bitva kontrastov Pidarasy i gengstakazachki ehti bratstva povesjat znachki kak na rance ljamochki I koekto tut ebyotsja v ochki verno zadolgo do pensii A u nas rozovejut zrachki ot vetra Okolesica l'yotsja pesnej kakoj russkij ne ljubit ezdy na meste Poehtomu v kletku trassa pestrit A ehto detka prosto kresty vdol' dorogi breda pustynnoj Poehtomu v kletku trassa pestrit A ehto detka prosto kresty vdol' dorogi breda pustynnoj  Russkoe pole ehksperimentov Russkoe pole ehksperimentov Vechnost' pahnet neft'ju  Ne step' i ne prerija strogo russkoe pole My dolboyoby s mjachikami mezhdu nog kak v futbole Povedaem za poezdku dohuisze kulstori Kak bili pod Domodedovym goja i azerbona Pole  nasha zhizn' uporoty virazhi SZyoki rumjanye ot kajfa budto gomikvizazhist Kalom zamazany szi i odekolon SHipr  ved' on zhiv byl kumir Roma ZHigan V pal'to i ZHiharka  SHilo kosher  Gematogen hristianskih detej est Germogen Kak u German Gref govnom karmany polny Sergej Gormash  ikona lavash iz mam Oksimirona Bagazh  grob i vintov polno davi Vandal Vsyo chern' pod kolesami mimo BAM i Gribanal SHiroka strana rodnaja KGB s nami My pravy za nas telega istorij  Gelentvagen I Harlamov Garik haram i garik My ugaraem diko rjadom s nami Krishna Hari Grad Kitezh kalik ne bog  Respekt ot rehpera  to zhe plevok rot v rot Zarjadim pesni  koli  Napadaet my kak Makkabi tryohochkovyj zab'yom ZHal' nikak bez torgovli eblom  shoubiznes No my s nimi ne sjadem srat' na odnom pole bratishka My ohuennye slishkom huk budto by veloriksha Fanaty Danelii KiSHa DDT Alisy Govnari i kisy slilis' v edinom ehkstaze I Kasper Hauzer na svjazi nyobo zhzhyot ledokol Krasin  Russkoe pole ehksperimentov Russkoe pole ehksperimentov Russkoe pole ehksperimentov Russkoe pole ehksperimentov  Vechnost' pahnet neft'ju
