,lyrics
0,Te kto ne nashyol schast'ja Tem kto i ne iskal ego Tevton kak sredi jastreb ja Te kto ne kiskal i vot Tehjp dom i o tom gospel Tekstov i basnej slova I okov brjacan'e vo sne Iakov odobrjal arestant  Monarhi odin iz zhivotnoj stadii ehvoljucii na Lune Zakonchiv za cikl dolzhny byli nachat' novuju istoriju uzhasa na Zemle I nachat' zdes' chelovecheskuju ehvoljuciju Oni byli temi implantami kotorye Luna Dolzhna byla peredat' Zemle dlja dal'nejshego razvitija Togda kak skazano v legende pro  Velikie vladyki dali prikaz    Padali zvyozdy padali Kapali slyozy kapali Padali zvyozdy padali Nado li plakat' nado li Eszyo raz Padali zvyozdy padali Kapali slyozy kapali Padali zvyozdy padali Nado li plakat' kropali  Der'mo kto rasstrel zhizni Gde toksik klejmo shizik Na tron vzgromozdivshis' Pljashet tanec ambicij  Belye zuby v temnotu ulybka Svet iskrennechistyj Potom na ambrazuru kak Misima Spasibo no my ne messija  Padali zvyozdy padali Kapali slyozy kapali Padali zvyozdy padali Nado li plakat' nado li Eszyo raz
1,Druz'ja ja hochu skazat' ja zashkvarilsja JA zashkvarilsja no ne potomu chto batljus' s nim szjas ja ob#jasnju vam vsyo Eee Privet Gene Rickey F Vitale Alphavit Ajo Pu Raa Ajo JA poprosil bity pomedlennej 140 bpm Ved' ja ne umeju morgat' tut bystree chem Illumate A ty slovno Eminem belyj negr na bite Buker DFred ehto znachit na anglijskom lohoped YObanyj ty bomzh v pryszah vsyo lico Tvoe novoe flow perechitaet EHzop dazhe Ty hot' nazhris' pirozhkov Ty ne molodoj CHinaski ty Artur Pirozhkov Kto vinovento chto batl ehto prosto parodija Kto vinoven to chto kazhdyj batlreper jurodivyj JA otvechu EHto ja ja vo vsyom vinovat zdes' ved' ja batlju tol'ko s koreshami  Dzhubili Hovanskij Oni govorjat ja nounehjm No zhal li vam ruku Malikov My znaem otvet Versus Battle  ehto topovaja liga v strane Restorator katit na Bimere vy na hue Obladaet obrygan Loqiemean i Obe Van batljat pod odejalom ved' ih tam batlit pavian Ves' batlrehp truslivye bljadi Fresh Blood  polnyj pizdec Vy vsyo proebali stydno za ehto Kak bylo stydno i v nojabre I gde zhe vashi bojcy Garri Topor JUbilej I esli ehto cirk vot vam topovyj hod Ustrojte battl karlikov  Dzharahov i Vova Gnom I tol'ko sam Oksimiron sam Oksimiron s nebes spustilsja chtoby zaszitit' svoj batlovyj tron Respuktulja nosatyj Ty ne zabatlish' Galata no zabatlish' na teleke Harlamova i Borata CHto do Bukera Buker kruche vseh vas No ja ebu Bukera kak staruh u sberkass Kak Staruha ebala Bukera god nazad Molodaja krov' idyot nahuj ved' ja tut superstar  Antihajp Zamaj zdes' nastojaszij ne zashkvarennyj Reposty pravil'nye lajki lajki Blja mne tak ehto nravitsja Bro YOu YOu YOu Zamaj staryj huj EHj dedulja pogodi ty zaletel ne v tu shalavu Vyshel batlit' na bity i srazu prjachesh'sja pod nary V dvuh slovah ty petushara V tryoh slovah Zamaj ty petushara Hochesh' battl no potyok ot Hovana kak budto shava Pishesh' v Tvitter Pishesh' dissy Hochesh' bifa Slyshish' pidor Stariku nado medal' dat' za to chto on smog doehat' Prihozhu ebat' dedov v publichnom dome prestarelyh Kogda batlish'sja boish'sja proebat' vstavnuju cheljust' A lico budto hochet chtoby dali deneg Pensioner rasslab'sja Popej chayok s malinoj Ty hripish' kak motocikl chto zapravili ssaninoj Dostaju klinok iz sala kak korol' Artur Hohol Videl ty drochil na video gde tvyorkal Faraon Hotel sest' na tron no v itoge sel na kol Ty mozhesh' hvastat'sja pobedoj no ne mozhesh' kadykom I pohuj na rifmy i shutki zaja Pohuj pojmyotli narod iz zala Dehdehdeh dehdehdeh dehdehda nichego ne ponjatno No vsyo ravno luchshe Zamaja I pohuj na rifmy i shutki zaja Pohuj pojmyotli narod iz zala Dehdehdeh dehdehdeh dehdehda nichego ne ponjatno No vsyo ravno luchshe Zamaja bitch  Davaj pogromche navali Ili on vsegda takoj Flippat' ne budu ved' flipal Iuda Ajo je Ha Prisjad' nedorehperok JAdernyj flou tebe na tretij raund pribereg A poka  poebu i bez gandona Bez Vovy Gnoma mne neudobno Nu chto Byt' rehperom dovol'no tjazhelo No ty vyros v ogorode  ne znaesh' ved' ty zhe loh Ty u reki v detstve repetitroval s kamnem Dazhe assinezatory tebja zvali Skamom Teper' ty lezesh' v rehp kak baran Ty umen kak Galattalant V tebe gruppa Zakat  10 pidorov V moem lice tebja kirgizy vyebut Bro ty krot Tvoj rot  nora U tebja tam Depo shirokij Boulevard Takoj grafoman chto Mnogoznaal Znaesh' kto Basic Boy skazal Ty Basic Boy  prostoj loshok I na tebe bljad' Glebasta spal JA SlipahNeSpi Big Russian Boss Moj Dopetape ehto white star Zloj negr ja shlju nahuj tvoego Stepana Karmu U menja koversamolet ja Han Otpravljajsja k Blejzu pedik na divan obratno Vo mne 5 butylok vodki ksanaks skitlz V tebe 5 butylok v zhope tebja ebala gorilla Bljad' ty dumal ehto shutki battl so mnoj No tut ne Iisus batlit sam Bog Palicy rubjat golovy s plech ja tut Antihajp I zashkvarov korol'  Thomas Mraz vrun i obmanszik Tvoi zashkvary Zamaj tvoi zashkvary Zamaj tvoi zashkvary Tvoi zashkvary  HipHop kollektor Pochemu ty polagal chto HipHop  kollega JA iskal HipHop tam HipHopa netu Stremnye teksta  HipHop kaleka Ty so mnoju v Antihype no v sem'e ne bez Zamaja U tebja serdce vstanet esli ty tak zachitaesh' Ne iz zamka v zamok a iz zhopy v rot 8 let na vpiske tebja ebet moj flou Sazhaju na zalupu kak detej na karusel' Tvoi teksty publikujutsja v zhurnale Telesem' EHj slysh' pidor ty hripel na bity Oni zaboleli SPIDom Oni pishut v kommentah nahuj Bukera Znaesh' zachem Tebe interesno Oni pishut v kommentah na huj Bukera CHto by Zamaj vsegda znal svoe mesto Glad' svoih chtob chuzhie bojalis'  Delaju ehto kak professional Dud' sprosit tebja CHto ty zarabotal v rehpe Ty pokazhesh' emu svoj probityj anal Battlish'sja chtob potom fitovat'  JA zovu tebja Rickey F No slysh' dedok dostaju svoj stvol Uberu tebja s dvuh not Re Do  Ty zrja na Genu navyebyvalsja EHto vse zrja bratan za svoih streljaju v upor bljad' Gena my s toboj EHjou je Samyj nenavidimyj MC Vylechu tebja ot rehpa kak Kagocel Ty ne JAng Treppa  ty JAng Tripper Ljubish' buhat' Moej spermy vypej loh Nahuj ty zdes' Luchshe b sazhal nahuj detej Kak Oksi  preljubodej No Oksi  respekt a tebe net JA obmanul ty kak Varum  CHitaesh' v huj a ja  Agutin Dazhe pri ljudjah ebu ehtu suchku  Bukera bez priljudij Moj chlen  tvoj poslednij puut' O chel  u menja ogromnyj huj JA hochu chtoby nash batl sudil JUrij Dud' CHtoby pod shumok potom JUriju vdut' Da Hovanskomu Blja budu ebat' Hovanskogo JA tak budu ebat' Hovanskogo CHto Hovanskomu ehto ponravitsja On pribezhit i poprosit eszyo Marionetka yobanyj chyort Ebal tebja v rot vot i ves' panch Smysl prostoj kak yob tvoju mat' Raa Flou Boga a u Hovy rot kokan Smysl prostoj kak yob tvoju mat' Raa Flou Boga a u Hovy rot kokan Tam huyov stol'ko chto Mozhno vzorvat' s belkom bomby V zhope proyom ogromnyj  Tam pasutsja cyganskie koni Sprjatalsja malen'kij tampon Obi Pomogite Emu ochen' bol'no Zovi menja Koba JA vyrezhu vsju tvoju shoblu uyobok Zovi musorov ved' tvoj stil' Po ljubomu huyovyj Da JA pozhiraju hajp A ty vyrezaj Zamaj JA pridu pod noch'ju pokrovom I vyrezhu sebe kuplet Oksimirona Buker klyovyj  Ty kak primanka dlja klyova JA slovlju na tebja gepatitvich I dizlajkpogony SHaraut Rifmy i panchi Tut ser'eznye igry mal'chik Menja nenavidjat v dva raza bol'she tebja  Ty ponjal kto tut samyj hajpovyj A Raa EHto tebe za Genu bljad' Gena derzhis'  Nahuj Nahuj Bukera Nahuj Nahuj Nahuj Nahuj JAja jo Prr' Moe lico kak Bul'doggi Dog Tvoe lico kak bul'on s der'mom JA na rajone ja s kosjakom Ty takoj gomik chto sral huem Oj oj oj Ty szekochesh' moj huj borodoj Ty russkij  ne nado zalivat' Ty ne Antihype ja tut Antihach Vyebonish' na Karmu  EHto krajne zabavno Ty vyebonish' na vseh No pered tem kidaesh' sharauty Budu medlenno chitat' Zaebala taratorka pod 140  EHto mozhet delat' dazhe sranyj shkol'nik Ladno shuchu Ty kak ja ne mozhesh' Moj rehp po vene bajanom vozduh JA venom budto Montana Brizi Ty zhenstvennej chem Montana Mozee  Purple da Egor Krid boys JA Kosti ne po rostu pesik Tvoj klik bosyj EHto boj s final'nym Bossom Zaebal menja budto by kamni v kedah MC Ty nikogda im ne byl Starik bity slushal s patefona Da ty hripish' budto batja Brolla Mir protiv menja JA prav Ty ljubil drochit' po uglam Kurit' shabit' masturbirovat' po boku Panch kak ura mavashi v golovu Zamaj ja slyshu staryj sranyj bespont Vyebonit tut na vseh budto babka u pod#ezda Budto babka u pod#ezda ebanyj dedok  CHtoby popast' na battl  ty u JAna prosish' nomerok Moi stroki obossali tebja s nog do bljad' Vyebonit tut na vseh budto babka u pod#ezda Babka u pod#ezda slyshish' ebannyj dedok CHtoby popast' na battl  ty u JAna prosish' nomerok Moi stroki obossali tebja s nog do golovy V tvoej zhope ne nahodjat dazhe kopy narkoty Ty podumal chto ty klyovyj tipa ebanyj batyj Tebe nuzhen perevodchik tipa dorapovodyr' Zabral tusu kak Putin v nulevyh Govorju chisto po faktu  JA ubivaju deda na bitah Ved' on perepisal na menja svoju hatu Raa
2,Sanja chyo za hujnja CHyo za vsratyj battl JA mechtal srazhat'sja lish' s antihajpom  SD Bukerom Galatom Ne k ehtomu menja gotovila zhizn' ehto chyo final ligi invalidov CHyo za borodataja hueta naprotiv ty pohozh na togo kto vyebal pedofila No ladno ja rasskazhu predystoriju naschyot ehtogo battla Koroche bylo nachalo zharkogo leta my v shubah poteli kak mogli Sidel doma pisal kuplety na battl na vehjpvystavke s Mlechnym pod bity Znaete konec istorii pro vehjp battl Na menja napalo mlechnoe prokljat'e i ja tekst zabyl Pishet Restorator  Bratan nuzhen eszyo battl final ot Lyohi Med' vse otkazalis' nuzhno spasat' ego zad JA vzjal vremja podumat' nu takoe poshyol v kachalku guljat' Vozvraszajus'  soobszenie ot Lyohi  Ne hotelos' by s tovariszami battlit' no ne prihoditsja vybirat' I udalil stranicu v vk Lyoha che za hujnja JA eszyo ne soglasilsja ty ispugalsja uzhe sidel s trjasuszimisja rukami oprokinul soljarki fuzher i napisal Dumaju nichego lichnogo ne nado v battl est' veszi kotorye dolzhny ostat'sja mezhdu nami Lyoha ne perezhivaj u nas lichnogo nol' ehto ja ne byl kto na vpiske tebja vyebal v rot Ty zaputalsja v svoih slovah znakomyh faktah inache otkuda ehta tema tipa Lyohe pohuj nahuj Vot tak vot Lyoha Znaesh' tochno vybirat' ne prihoditsja Ty mechesh'sja s huja na huj budto mat'bogorodica oplodotvoril by hot' kto No ja zdes' znachit battlish' s bogom vyebu bez proniknovenija i tebe stanet bol'no Tvoej zastrel'szik kar'ery vseh nerozhdennyh lajkov tebja ja sbroshu s kar'era gopnik ne Haski lajka JA tut Andrej Tretij Rejh zapeku tvoju tushku na uzhin Ty patriarh Aleksgej no nikomu nahuj ne nuzhen Pisal mne Predlagaju battl obraz protiv obraza Kakoj bljat' obraz Po obrazu tebe battlit' Gobozova U menja obraza net no iskusstva perevoploszus' radi A pered tvoim obrazom mne stydno budto ja ebus' v hrame Posle proshlogo battla s SD Oksimiron nazval menja postmodernistom okej ja kazhdyj mig novyj Vchera diss na JUrika zavtra fit s Hovoj Kakim obrazom ty menja odnomernyj battlit' reshil Skazhesh' Ty ne muzhik a ja blja muzhik Vot uzh tochno skazannoe toboj ne vyrubit' toporom No to chto panchej v tebe net ne znachit chto ty Oksimiron Pisal mne  Dumaju u nas vyjdet battl o podhodah k tvorchestvu No ty pohodish' tol'ko na rol' buhogo otchima v dvuhcvetnyj fil'm Zvjaginceva gde kazhdyj v Rossii  monstr Pretencioznyj i poshlyj ty komik Mihail Zadornov Tvoj podhod k tvorchestvu  tri raza huj po desjat' otzhimanij CHtob tvoju topku zatknut' iz pechi bljat' evrei ozhivali Moj podhod  ehto provokacija vot tebe vse karty na stol JA mogu dazhe pod#ebat' samogo sebja prosto zabattliv s toboj Ved' mne s toboj neprijatno ty unylyj ne vru Vot chto znachit prinjat' vyzov i vstupit' v igru Posmotri v zerkalo kloun ty Verka Serdjuchka Borodataja zhenszina bljat' smehuechki pojuszij Nasmeshka nad jumorom Lyoha  shljuha v mehah JA zakazhu tebja na dnjuhu sebe pljasat' kankan Tvoj smertel'nyj nomer pod kupolom  blevat' v tolpu Medved' na velosipede szhimaj moj huj kak rul' Martyshka s granatoj ja raspnu tebja ved' ty akrobat ZHongliruj jajcami moimi plebei cirka hotjat Mne odnogo tebja malo ja v tishine proberus' i vsju truppu peredushu Sanja bljat' daj mne normal'nogo sopernika  Hovanskogo Da ne shuchu Hovanskomu nuzhen shum Poshumite dlja Hovanskogo Koroche hochesh' battl  poshyol nahuj tak govoril Rajtraun Raund  Est' filosofskij vopros Kto zhe v samom dele Lyoha takoj Tebja preparirovali mnogo no ne zalez pod rebra nikto Ty vrode gopnik s nizov goblin dlja modnyh  pevcov No advokat vsego huevogo kak Dmitrij Pevcov I ves' tvoj banditskij Peterburg  streljat' sebe iz pis'ki v lico Polkovnik bez zvezd Papazoglo tupoj Ty ne sluzhil ty prisluzhival pered golodnoj tolpoj Lebezil pered kentuhami no nikto tam ne bro Mozhet ty tot zlobnyj doktor chto beret mazok iz huev Da ty ljubish' szhimat' chleny kumir tvoj ZaherMazoh Sanja znaesh' mne kazhetsja Lyoha  uebok so Slova Ne razobrat' shutki za ego ochkami nikak Dnyom bezopasno vysiraet pro govno i zhopu a noch'ju prevraszaetsja v tekstovika I oryot Nahuj versus tam nuzhno huevo shutit' oni ne ponimajut pravil'nyj smysl shemy i rifmy JA ih raskroju tam vsyo nepravda ne tru a shou Pojdu tuda vsem dokazhu budu shutit' pro huj i zhopu Genial'no Noch'ju chitaesh' Bodlera dnyom chitaesh' rehp Ty prjam odin v odin kak tvoj tovarisz Illumate No znaesh' chyo ja vizhu v ehtom teoriju zagovora Ty bljat' zatail obidu Ot#ebis' ot iljumehjta pidor on prinyos alfavit v Rossiju Kstati on zhe perevyoz Alfavita v Rossiju da A ty che prines Hujni na stol CHtob na tvoyom fone kazalis' umnej obyvaly Ty vkljuchaesh' dolboeba ot bol'shih mozgov Intellektual i odnovremenno bydlochok  takih ne byvaet Podpisyvajtes' v pablik skoro novye zashkvary delajte donaty skoro ne u menja novye battly No chto ty mozhesh' im dat' Ty vtorichen kak kal zabronzovevshaja figura I dazhe ne Lenin sistemy gde kazhdyj rzhet no boitsja podnjat' na smeh sebja  Ty glavnyj predstavitel' golosa sraki pokolenij No v muzyke ty starover moesh'sja odin raz v god Tol'ko protuh do sroka godnosti kak al'bom Gribov K novoj religii ty podstroit'sja i razvit'sja ne smog Da ty i ne byl andegraund tebja vyebal pop I zdes' u nas v golubom ogon'ke tvoja zhopa sijaet neistovo No znaj edinstvennyj normal'nyj hejter v bushlate byla Dana Borisova Znaesh' mozhet ty konceptualist Vsja tvoja zhizn' ehto roli igranija Vsegda mechtal vyhodit' v teatre na bis no odno to chto ty ebanutyj  ne znachit chto ty Lyoha Panin Ty drochil v zhenskom plat'e Sosal huj u sobaki Kakoj ty v pizdu konceptualist Ty pohozh na Dzhubili i ne tol'ko eblom On tozhe schitaet chto versus  ehto promoplatforma fabrika zvezd Sanja on vseh nas nazval pidorami Platforma dlja hajpa huesos EHto ty tak Rikki zaviduesh' Da ehto uzhe pervyj kanal gde ja v zapisi govorju chto ja ebal tebja v rot I pust' ja dazhe Zamaj ehto tochno ne vyrezhut Vidish' Smotri smotri ja mogu ehkspluatirovat' mem No ehkspluatirovat' mem chtoby posmejat'sja nad memom JA zapisal trek pro SHuryginu chtoby pozlit' ih vseh Ty ne uspel fit s Malikovym potomu chto hajpit' ne umeesh' No znaesh' chto vsyo smeshalos' v dome Oksimirona Bratul' otec rodnoj kuda propal Vozvraszajsja trahat' mat' Tut malen'kij huj Dzharahova skoro zabatlit malen'kij huj I pereodelis' te kto slal nahuj teh kto prihodit na battl chisto porzhat' da Tut bljat' byvaet smeshno no chasto ne ot togo chto kazhdaja shutka  shutka I esli ja skazhu chto ty smeshon to ehto budet ne shutka SHutka Ty surovyj muzhik podnjal prodazhi nokia ih pokupajut bomzhi chtob podpisat'sja na pablik Lyohi Ne ne nahuj obraz ja verju ty prjam takoj Stoit kolom ved' kormili brolom v armejke Ty strimish' kak smotrish' za vsemi Tebja pokusal Djadja Mops v ochkah kak Rick Ross ty pervyj vertuhajrehper I znaesh' ehto vsyo ob#jasnjaet stil' i bydlyozh CHto v kazhdom nevinovnom Ptahe iszesh' petuhov Kvadrat i fal'sh' kak u Mishi Kruga pishet lish' mednaja zhopa I tvoi prjamolinejnye barsy ehto tjuremnaja reshetka U menja est' insajdy kakto Lyoha prosnulsja utrom s razdrochennoj zhopoj dazhe bushlat v konche utonul Kollegi pribegajut i sprashivajut  Kto ehto sdelal Lyoha I on zakrichal Karaul U tebja sindrom ohrannika u tebja dazhe est' lichnyj shlagbaum Sidish' za monitorom i za vsemi nami palish' U tebja dazhe est' korochka Na zalupe Ty Aleksej Anal'nyj T'fu na tebja ty vsyo vresh' Car' battlov bez korony tvoj stul  tron s hujami Primer' Raund  Lyoha bljat' zachem ty zdes' V chyom performansa sut' Pokazhi zhopu esli hochesh' veselit' tolpu A ona rzhyot nad toboj no vrjad li ty na ehto rasschityval I ja ne pro ochko tvoyo no tut ty u koryta razbitogo Ty  presmykajuszeesja pered prosmotrami na hajp koncert No ja budu tol'ko v pljuse esli moyo eblo na montazhe perekrojut Ty prishyol chtoto reklamrovat' cherez svoj debil'nyj tekst Znaj normal'nye pacany tut radi finala PohoronilTirehps Ty bilsja s Lukashenko kak lev CHtoby v osnovu vlezt' kartoshku s#el no s hajpa tak i ne zarabotal na hleb Battlish' vsegda pered kemto  EHrnesto Gnojnyj kartavyj zhid Na razogreve vsegda no odin lish' tvoj pukan gorit Tut byl ehlektromontyor a ja mikroehlektronszik izvestno Zasunu tebe v zhopu pajal'nik chtob spalit' tvoj central'nyj processor Zatronu vsyo chto tebe dorogo zastavlju tvoju pamjat' dolgo stradat' JA po obrazovaniju fizik a znachit zhmu ot grudi bol'she tebja A tvoja mat'  plata Za oshibki deda On vyebal tushenku i dal start dinastii mednoj Med' dynasty tvar' No kak banku ne kruti ne pojmyosh' tam mal'chik ili devochka Tvoj bratik  Mozi Montana a sestra  Monetochka Vidish' Lyoha ja ohuennyj shutnik nastol'ko chto ne smeshno No tvoim suszestvovaniem na battlah bljat' oposhleno vsyo Tvoi mysli otsustvujut shutki  gumus dlja liberalov i daunov Vtorye ne dogonjajut pervye dumajut bol'she chem nadobno I ty mechesh'sja mechesh'sja vlog strim Ty vrode viking no vnutri tyoplen'kij Gol'fstrim I tvoj bushlat tebe nuzhen igrat' v tanki na kb I ty pogibnesh' ne v boju a kogda vykljuchat internet Da a v internete ty kto Veduszij peredachi Razbor pomyotov Koprospecialist Lyoha  rabotnik goda A ty znaesh' chto cherez 100 let pererabotannoj bioorganikoj fekalijami kak v matrice budut spasat' ot goloda planetu Ved' tam est' neusvoennyj material ja zovu tebja Lyoha 40 procentov Ty bljat' tochno iz buduszego prishyol chtoby nas kormit' govnom CHtoto shipish' budto zalit' karbid vodoj Dlja nih ehto bitva goda za zvanie samyj huevyj No mne pohuj ehto po kajfu ved' ja rehper v bitvah rozhdyonnyj Iz teh vremen kogda rehp bylo stydno kogda pizdili shirokoshtannyh Tebe zhe nuzhno ih odobrenie chtob tebja uvazhali No za chto Tebja net Ty pustyshka pshik chyo to zhuzhzhish' tebja ne slyshno muha navoznaja  Vzhik Uprekal abbu chto battlrehperu vsegda dokazat' chtoto sverbit no ja vizhu chtob ty pahal kak raby do gorba na spinah Ty zalozhnik slabogo obraza sam sebe terrorist i raskrutish'sja lish' na huju kak modnyj ebanyj spinner CHyo uzh govorit' Lyoha ty dissil Skrudzhi tebe otvetil Illjumejt blazhennyj Deepexsense Ty vsegda sebe vybiraesh' chtoto protuhshee v uzhin no v battle kolleg tebe nasral by na lico dazhe rehper Face Takih kak ty ja zovu Sejmur  vsem pohuj na tebja chmo Ty pereigryvaesh' nedoigryvaesh' pljusminus na vyhode nol' Otozhmis' trjapka ja tut lejtenant mladshij mal'chik molodoj vse hotjat potancevat' so mnoj prikin' Tebja zh hotjat otpizdit' ty dazhe snjal serial sladkij Zelyonyj Slonik 9 skoro vo vseh parashah strany Ty bljat' rozhdyon byt' populjarnym jutub ljubit frikov no ty ne Lyoha Tehnik drug ty Pasha Mikus Dazhe v sorevnovanii uebkov ty samyj nikchemnyj tol'ko obmazavshis' v konche ty dob'esh'sja partnerki Ideal'nyj kinogeroj o tebe snimet fil'm Sasha Spilberg Vzlomat' ochko Lyohi Med' za 5 sekund 2 Genial'naja akterskaja igra prizy Kinotavr Nika Ty dobilsja chego hotel tak i vizhu poster  tvoja ogromnaja sraka razmerom  s fasad SHokolad ne vinovat Raund
