,lyrics
125,EHto Prozhekt Zero Frunzecentr Dve revoljucii podrjad za pjatiletku Radi vseh svoih rebjat rab v golove tut Gde by urabotat' babok i pustit' po vetru  Marsh nesoglasnyh v golovah tysz No dazhe vne transparanta kazhdyj komrad  nisz Mechtaet zarubezh ot'ehat' za zhratvoj  hlysz Na ego gladkoj zhope uspeha bol'shoj  prysz My v kapjushonah i krossah krasavcy Dym v obed na uzhin na zavtrak Blednyj mir bosyh povakacci Krov'ju gospod razukrasim nautjuzhen zla frak Abstrakt rap ol' pank da nam pohuj Nash brat vezde  goj ne pan na eblo hud Poputno dali vechnaja zima Pust' geroi  my naruto da lish' veszi kazemat I v nih ja zapert huj razlomaesh' zamok Na rasprodazhah  raz v god ljud sobirajut v zagon Sdirajut s tulovisz merki mogut zabrat' i mazok Da kasi zaher podvodjat sistema Zaher Mazoh Balahon kak gimn golodnym i obezdolennym Golodnym i obezdolennym gimn pishet istorija No raz v stoletie i Avrora gromit Bogateju nelepyj sejn no ne vorovannyj bit  bandit  Nash hiphop kak zapiski podpol'ja Odna pravda  lish' dlja istovyh voinov Pod pristal'nym vzorom zavistnyh s bezbol'noj Izgoi besov'ja molis' za zdorov'ja Nash hiphop kak zapiski podpol'ja Odna pravda  lish' dlja istovyh voinov Pod pristal'nym vzorom zavistnyh s bezbol'noj Izgoi besov'ja molis' za zdorov'e  Ty zhiv ne pokojnik hul' golovoj ponik  drug Hot' vsyo vokrug blud i konflikt kuk Pochti spasyon i glup opjat' vlip  trup Temjashovy cennosti zhizni ne v pizdu Zavojuj sam novyj rassvet Gde budusznost' gody s osankoj Hvost ne bezhat' s rodiny pozhdav shapkoj Gotovo l' ispit' vina i vkusit' hleb Moroz a ne Santa I pafos k raz moj opravdan sogrej ruki druzej ja ne Karman JA ne unylyj mudak ved' Banal'nym byt'  haram Tak chto voruj ubivaj grab' karavan Poj Cagaan Haan Ved' uragan  bitlo v ushah  salam Han I ne uchastnik bojni za vlast' huliganham Da ne nashist i ne protiv on po sebe sam On nosit kol'chugu ot najk dazhe v purgu sneg Ego lachuga na okraine ego put'  smert' On otshel'nik kochuet v kosmicheskom poiske sfer Ego muzyka  ehto chudo No ogolyonnyj nerv  Nash hiphop kak zapiski podpol'ja Odna pravda  lish' dlja istovyh voinov Pod pristal'nym vzorom zavistnyh s bezbol'noj Izgoi besov'ja molis' za zdorov'ja Nash hiphop kak zapiski podpol'ja Odna pravda  lish' dlja istovyh voinov Pod pristal'nym vzorom zavistnyh s bezbol'noj Izgoi besov'ja molis' za zdorov'e Nash hiphop kak zapiski podpol'ja Odna pravda  lish' dlja istovyh voinov Pod pristal'nym vzorom zavistnyh s bezbol'noj Izgoi besov'ja molis' za zdorov'ja Nash hiphop kak zapiski podpol'ja Odna pravda  lish' dlja istovyh voinov Pod pristal'nym vzorom zavistnyh s bezbol'noj Izgoi besov'ja molis' za zdorov'e  I avtor zapisok i samye Zapiski razumeetsja vymyshleny Tem ne menee takie lica kak sochinitel' takih zapisok ne tol'ko mogut no dazhe dolzhny suszestvovat' v nashem obszestve vzjav v soobrazhenie te obstojatel'stva pri kotoryh voobsze skladyvalos' nashe obszestvo JA hotel vyvesti pered lico publiki povidnee obyknovennogo odin iz harakterov protekshego nedavnego vremeni EHto  odin iz predstavitelej esze dozhivajuszego pokolenija V ehtom otryvke ehto lico rekomenduet samogo sebja svoj vzgljad i kak by hochet vyjasnit' te prichiny po kotorym ono javilos' i dolzhno bylo javit'sja v nashej srede
126,Jou my tut inostrannye agenty jou privet Poyom pod basurmanskie sehmply  zasudi menja i glavnoe ne grusti  hujnja vojna glavnoe manyovry starost' ne radost' molodost' ne zhizn' My nastol'ko kruty chto pizdec ZHmyk na rajon doebat'sja Do bogateja aki Bill Gejts Do goparja  CHuesh' pary alkogolja  ehto myrk zdes' JA v kepe sviter krossy rjasa Byl pacan i net pacana  ischez Iszisviszi teper' popsarja sam Nasha pohodka legka  para cripple Tut vegan vopi  net bol'she mjasa JA byl sozdan   prikol Gonjaju za piter  Hodzhanijazov So mnoj bezumcy  kazhdyj kak Bel'fegor Poehavshij behnd bomzh roszi vjazov Balovni sud'by  jazva i gorb Super priz   No vsyo horosho vsyo prekrasno markiza Da my plohi  ne smotri na nas s ukoriznoj Da my  lohi bez pasporta i propiski Nasha mahina peremelet rjazhenyh bystro Na obed s#em parenu repu Rapp nachiszu potom porjanu repu I nash rep ne voz'mut v  Ved' my nikak ne voz'myom herovu repigru  Zapreszyonnye ljudi kladut Usejn Bolt Zapreszyonnye ljudi  Zapreszyonnye ljudi v adu sejut zlo Zapreszyonnye ljudi  Zapreszyonnye ljudi a la 2pac zhiv Zapreszyonnye ljudi  Zapreszyonnye ljudi slovno mutant vzhik Zapreszyonnye ljudi zapreszyonnye Vnov' ponastroim hujni iz nichego Konflikt vojna na pustom meste Kor' mozoli natoptyshi  poterpi szenok Generalom nelepyh vojsk s tonom vesti Byt' tebe i puskaj ty poka lish' niszebrod Gluboko pod vodoj kak Kusto vechno Vrag tvoj  rozovyj brojler a ty  drysz no gord Mechta v serdce  v pechi zhiv'yom ispech' ih Posmotri uzhe gulit olen' Lajut koty shumjat liliputy Nash prezident  tupa hilyj pen' V tjur'me druzhny Naval'nyj i Putin Zima ne budet i ty ne bolej My voskresili Hrista i Maljutu Prazdnik besplatnyj geroin pivo pel'meni A esli bez shutok pizda kajuk nam Nas zanesli v bazu dannyh Pridyot velikan i po zubam dast JA znaju gosudarstvo Zakljuchit v ob#jatijah kak sutana Demokratija perspektiva  neogopak Za koljuchej stanesh' unyl  Leo REpac No ja russkij  i privaren plotno Mne pohuj i pohuj byvaet bol'no  Zapreszyonnye ljudi kladut Usejn Bolt Zapreszyonnye ljudi  Zapreszyonnye ljudi v adu sejut zlo Zapreszyonnye ljudi  Zapreszyonnye ljudi a la 2pac zhiv Zapreszyonnye ljudi  Zapreszyonnye ljudi slovno mutant vshik Zapreszyonnye ljudi zapreszyonny
127,Zamai  zarin Zamai  zarin Zamai  zarin I on zdes' ne odin Zamai  zarin Zamai  zarin Zamai  zarin Iz kishlaka v nishtjaki Zamai  zarin Zamai  zarin Zamai  zarin I on zdes' ne odin Zamai  zarin Zamai  zarin Zamai  zarin Iz kishlaka v nishtjaki  Udushajuszii potok ehkspluatator ili Bog I vsyo odno zalyog na dno i tut ne dostanet nikto Udushajuszii potok budto pervorodnyi porok Pustoi vsenarodnyi pankrok loham ot vorot povorot  On samyi voshititel'nyi i ehto tochno Zabivaet trehochkovyi tvoei telke noch'ju Ty Billi Novik  loh cvetochnyi On Billy Joel  udar po pochkam Kak tam pozhivaet lichnyi vrag Oksimirona Olimpiiskii podhodjaszii protiv nego razmer voiska 21i vek novye metody voiny Doktor vskryvaet ehtot naryv I tam ne danaicev dary Tam prosto gnil' No Zaicyzamaicy ne bojatsja Ved' ty samyi bystryi na ehtoi korotkoi distancii A on tut staer holopy vosstali I tol'ko v tret'em lice pro nego ved' Bozhen'ka s nami Ha  Zamai  zarin Zamai  zarin Zamai  zarin I on zdes' ne odin Zamai  zarin Zamai  zarin Zamai  zarin Iz kishlaka v nishtjaki Zamai  zarin Zamai  zarin Zamai  zarin I on zdes' ne odin Zamai  zarin Zamai  zarin Zamai  zarin Iz kishlaka v nishtjaki  Udushajuszii potok ehkspluatator ili Bog I vsyo odno zalyog na dno i tut ne dostanet nikto Udushajuszii potok budto pervorodnyi porok Pustoi vsenarodnyi pankrok loham ot vorot povorot   Ljudi Poterjali Smysl iskusstva no my ved' Vnov' vosstanem v shvatke s bezdush'em Ljudi Poterjali Smysl iskusstva no my ved' Vnov' vosstanem v shvatke s bezdush'em  Udushajuszij potok Iz bolota do verhov Nenavist' pogubit no Za bitvoj novyj povorot V ehtoj edkoj kislote My loshkov vseh pobedim Rok smetyot kapitalizm Ostanetsja lish' zarin
128,Opjat' vsyo tot zhe ebanyj marshrut V rukah szhimaju iz strahov mashnu  Oligarh gde neljudi nas uzhe zhdut Ebat' Ural Izengard i Mashuk Schast'e  dzhihad  nam  tancy v adu Na kajf daj kvitanciju ili kajuk Prazdniksjur gam svadebnyj shum Davaj sjuda shval' po odnomu Bozhus' ubogij mne budto delat' nehuj  Bomzhu ispolnju trekov  rehpEHdita P'eha Gurman  na uzhin horovody detej Plutarh v zauzhennoj da po mode dzhinse Slugu carja ne povezyot tramvaj Do ostanovki v zakate vybozhit krasnyj Surgut Car'grad Bajazet Karabaj Golosuet iskrenne na vyborah v jasli Nu blja i ja s nimi Tozhe zh hochu byt' prizvan V ehtot novyj chudesnyj mir gde ne lachugi  rizny CHudoslyozy chekista na suku zalupyr' CHurov  prem'erministr povelitel' iskusstva  Pyr'ev Ty skazhesh' EHto utopija no ja uzhe odnoj nogoj utop I v nej ochen' komfortno teplo i prikol'no CHto v obszem strogo  pohuj obrok ne tjanet jarmo  Evrej ne pozaviduet japonskij ozloblennyj goblin  Tozhe O Bozhe pogoda na rajone Dlja zdorov'ja ebovej dazhe chem nochi  Vidish' dym EHto tvoj pervyj obed Gorech' priprav' hrenom very na maner kotlet Sugrobov navalilo  ne pereshagnut' Padishahi topchut sapogami Nicshe krasotu Begu v lyogkih krossovkah da po sopkam Gorod dlja nevest ih zdes' les  massovka Raul' Kortes  zlodej no v obnoskah Kazhdyj bosota  missioner Bosha  Bespredel kak metod dobra tvorit Mechta ukusiv piroga udrat' v Magrib Tam solnce zhyoltye shtany ulov pal'my  ZHizn' bez zabot No Ulofom Pal'me Stanet udachnik stran pervogo mira Rubilom vragu obnuljaet Rossija Grehi pod osinoj
129,Itak v Peterburge prazdnujut pobedu Zenita v chempionate Rossii A v kotoryj raz V chest' ehtogo v gorode zazhgli fakely na Rostral'nyh kolonnah Antihajp Han Zamaj e Piterskij klub obespechil sebe pervoe mesto dosrochno CHempionom Zenit sdelal Sergej Semak Bogdanych  imenno tak ego nazyvajut i zhurnalisty i bolel'sziki Imenno tak Dvazhdy v god Pas I Gol Ratatata  Nahuj ostal'noj futbol  Zenit Zenit Nahuj vseh Trikolor tol'ko belyj goluboj sinij Gazprom Miller Rossija  Zenit Zenit Rossija Vsyo radi goroda na Neve i svoej sem'i Grra Nahuj ostal'noj futbol  Zenit Zenit Trikolor tol'ko belyj goluboj sinij Tol'ko tak Gazprom Miller Rossija  Zenit Zenit Ha Vsyo radi goroda na Neve i svoej sem'i Zamaj  Zenit sil'nyj Begi k mechte Vperyod Vragi sosi CHyochyo Pri ljubyh raskladah my tut kruche vseh Nahuj ih  Nam ne platit Gosdep my ebanutye po zhizni Na funt liha promenjaem zabugornye manishki Nahuj ih Na pud soli my soglasny tol'ko by povoevat' Pupupu Russkie tvoju mat' huli nam gorevat' Novyj gorod  novyj zames I kak tak vysoko ty zalez Vchera eszyo byl vroven' travy a zavtra budem vyshe nebes No nebo  ne predel i takzhe menja ne pugaet mgla Vyhozhu i bez ballona ved' ne sranyj kosmonavt Antihajp  I vot ehtot vcherashnij den' on konechno stal istoricheskim osobenno dlja kluba Zenit V shestoj raz ja vot uchastvoval rjadom s komandnoj kommentiroval glavnye matchi posle kotoryh Zenit stal CHempionom  Nahuj ostal'noj futbol Zenit Zenit Nahuj vseh Trikolor tol'ko belyj goluboj sinij Gazprom mili Rossija Zenit Zenit Rossija Vsyo radi goroda na Neve i svoej sem'i Grra Nahuj ostal'noj futbol Zenit Zenit Trikolor tol'ko belyj goluboj sinij Tol'ko tak Gazprom mili Rossija Zenit Zenit Ha Vsyo radi goroda na Neve i svoej sem'i Zamaj  Zenit sil'nyj begi k mechte Vperyod Vragi sosi CHyochyo Pri ljubyh raskladah My tut kruche vseh Nahuj
130,Vchera vypal sneg i vpal v komu Zimu terpet' sil net uzhe  Halk Hogan Gorod pod kontrolem  Bashar Asad Nejmdropping navsegda  KarlMarksSHtadt JA luchu dobra budto Gormash rad Kak zamuchu govna  otvazhnyj Borat Brat davaj s toboj otvedaem pljushek Izgotovila Freken Bok  otpetaja shljuha SHuher Na pjatki dvadcat' vtoroj vek Nastupaet i v prjatki igraju poverh ven Rebjata iz avtomobilja ne slushajut rep Rebjata ved' iz Rossii  tam SHufik i Leps SHuba i meh pljus shutki i smeh Putin  Ramzes Pelevin  Veles Jes a ja obychnyj unylyj pizdjuk Noshu poverh triko tigrinogo gidrokostjum Koshu pod nigera  ne mojus' i pet'  ne poju Rehp  ehto striptizy ulic platil b interv'ju Pohuju interv'ju ty pogovori so mnoj Poka mir  Skajrim Morrouvind Obliv'on
131, Nikogda v zhizni ne videl chtob tak streljali Tol'ko v kino  A ja nikogda ne videl chtob tak igrali  Vuh JA vsyo tak zhe streljaju s dvuh Vsyo tak zhe ne sila a duh Mnogoe izmenilos' sprosi menja gde ja sejchas otvechu  ja tut JA tut Nichego ne izmenilos' ja vse tak zhe na ohote i vokrug betonnyj gorod Paupaupau JA v okruzhenii bratuh a ty v svoem okruzhenii protuh  Moj stil'  Double dunk ZHizn' NBA  ja ne doigral Zaszitu ne probit' shmaljaj dazhe tank Rehp iz Kyrgyzstana i do Balkan Kak Pinot Noir vraga sladkaja krov' I ty znaesh' sam kto tut han i korol' Karty na stol igra na zero Vse ili nichego Loshok EHto ne shahmaty udar po jajcam  ushat vody Vse ehti pajacy ushatany u tvoih pacev dusha baryg A my My tut za ideju i nash marafon v goru Nuzhen chemodan deneg i zolotoj rolex JA ne vechen da no budu tut godov sotnju U menja ogromnye shary ved' igrok v bouling  Vuh JA vsyo tak zhe streljaju s dvuh Vsyo tak zhe ne sila a duh Mnogoe izmenilos' sprosi menja gde ja sejchas otvechu  ja tut JA tut Nichego ne izmenilos' ja vsyo tak zhe na ohote i vokrug betonnyj gorod Paupaupau JA v okruzhenii bratuh a ty v svoem okruzhenii petuh  Gang shit devjat'devjat' Skol'ko e devjat'  996  ehto to otkuda ja Pohuj na slova za nas govorjat dela Dela 812 tut visit moja bratva Gang JA vsegda zarjazhen dazhe kogda shmouknul ehtu drjan' Drjan' Moi ljudi zdes' i my zasluzhivaem shans JA davno v ehtoj igre no v nastrojkah pervyj raz Okej Ty znaesh' moj stil'  ehto desjat' iz desjati Nam nado bol'she vseh znachit my topim do konca Rolju uzhe tretij no dlja nih ehto opasno Dvizhem dvizhemsja k pobede mutimmutim ehtot hasl Moi psy na starte kogda tvoi psy na pauze Pauza My iz teh kto zabiraet vse i srazu Malen'kaja suka delaj pape promo Skank vonjaet ljuto tebe mozhet stat' ploho Ploho Gamaju kak profi mne ne nuzhen kriminal Net So mnoj bol'shie djadja bitch ty v kurse kto imenno Gang  EHto liga chempionov My zdes' chtoby delat' milliony Trudimsja kak ono est' i vsyo v norme My v tvoyom dome zapomni nas houmi Zapomni 312j nomer Poka deti snimajut svoj tiktok Tiktok Konkretnye djadi nazhimajut na kurok Kurok Delaem ryvok zabiraem behnkrol Behnkbehnk Kazhdyj iz nas dostojnyj igrok Igrok Vsyo nachinalos' s mechty S mechty Teper' nas ne ostanovit' Ne ostanovit' You know what it is Hochesh'  nenavid' nas hochesh'  ljubi Okej S vysokoj kolokol'ni my plevali na teh Kto stoit na puti Na puti Pravila igry Libo tebja libo ty Pa Skvoz' plamennyj dym Pa JA ostalsja zhivym Pa Moj kazhdyj den' kak fil'm Pa Podzhigaju benzin skazhi mne Pa Kto esli ne my Kak podobaet Predstavit Predstavit 996 OG OG Iya I against I Haa Flesh of my flesh and mind of my mind My mind Hey bitch dont waste my time My time Dont waste my tiiime My time  Vuh JA vsyo tak zhe streljaju s dvuh Vsyo tak zhe ne sila a duh Mnogoe izmenilos' sprosi menja gde ja sejchas otvechu  ja tut JA tut JA vsyo tak zhe streljaju s dvuh S dvuh Vsyo tak zhe ne sila a duh Poljubomu svoyo zaberu Gimme the loot Gimme the loot
132,EHj ehj Andrej 10 MellowBite EHj Poljana Dozer 10 10 10 10 10  10 ljamov 10 grammov 10 klassov 10 ballov V 10 p'janyj v 10 jama V 10 kosjak v 10 tably  10 let nazad ja byl tak zhe molod 10 10 let nazad kak i szas byl poroh Eszyo raz 10 let spustja Vsyo ne nuzhno  promo Ne nado 10 let proleteli bystro  YOLO Vzhuh  10 pal'cev na rukah zagrebajut nal Da 10 let podrjad ja prodolzhaju zhit' kak pank Da 10 devok podstavljajut volosatyj bank Naa CHuju v 10 chuvstv vy poddelki budto Pandao I nam tol'ko v ad brat net puti nazad  fakt Net Otlichu ja semena ot plevel sredi 100 pravd Tochno Dom  ovrag Aga no ja Avraam Boss po sebe sam a tvoj nachal'nik  satrap Nu kak I v ehti gory ja vyberu uzkuju sredi trop Vsegda I ta doroga znaju ne ustlana serebrom Nikogda I vsyo govno minuem my vplav' ili vbrod Aga A moj hiphop udarit tol'ko v glaz a ne v brov' Des  101010  10 ljamov 10 grammov 10 10 klassov A 10 ballov 10 V 10 p'janyj v 10 jama V 10 kosjak Jojo v 10 tably Jo  10 let nazad ja byl tak zhe molod 10 10 let nazad kak i szas byl poroh 10 10 10 Eszyo raz 10 let spustja Vsyo ne nuzhno  promo 10 Ne nado 10 10 let proleteli bystro  YOLO 10 jojo Vzhuh  10 let potratil kak zhizn' sobaki chtoby stat' postarshe Khekhe Ran'she malo ponimal kak mir ustroen  teper' mne nestrashno Ne ponimal 10 pljus odin mnogo let proshlo dve my vsyo vzryvaem bashni Pum 10 mozhet byt' chislo opasnym v rezul'tate vypljunut kalashi EHj 1010 i vot pochti uzhe moja zhizn' tut ZHizn' Eszyo god proshyol i uzhe mne 21 god Uuu 10 zapovedej bylo 10 ne ubej i ne navri ty Ne Hotja by odnu pojmi ty Pojmi ne govorju na ivrite Vsyo prosto  10 let spustja budu molozhe chem Iisus Iisus Spustja 120 mesjacev ja vozvraszus' na Rus' Vernus' Vozrozhdenie recenzij na to chto uzhe davno proshlo Vremja toropit ljudej teper' ja sovsem ne pomnju otrezok bol'shoj zhizni Vsyo menjali pristrastie i otreshyonnost' Narkotiki i chelovechnost' cheljust'ju vremeni s#eli konechnost' CHeljust'ju Bol'she dvuh desjatkov let obretaju svoyo v ehtom mire Moyo vsyo pomenjalos' vlijanie stalo shire  Skol'ko let SZa mne 22 ja starajus' ne zabyvat' CHto bylo so mnoj 10 let nazad Moja pamjat' pomnit bol' ot obszeprinjatyh jarlykov EHj I kak oni zapolnjali mozg zastavljaja dumat' JA nikto no ja vyros i ja dam vam boj Boj Kak i 10 let nazad ja dumaju naperekor Kak i 10 let nazad v moyom soznanii hardkor Kak i 10 let nazad kak i 10 let nazad Kak i 10 let nazad kak i 10 let nazad  10 let nazad ja byl tak zhe molod 10 10 let nazad kak i szas byl poroh Eszyo raz 10 let spustja Vsyo ne nuzhno  promo Ne nado 10 let proleteli bystro  YOLO Vzhuh  Oj yomoyo Da Nu proslushaem chyo my zapisali
133,Problema ljubogo vyskazyvanija uzhe iznachal'no v tom chto dazhe na urovne intencii kogda ty tol'ko podumal o tom chto ty hochesh' o chyomto rasskazat' ili vyskazat'sja ty ponimaesh' chto ehto poshlo i banal'no ehto uzhe million raz suszestvovalo zachem eszyo raz ehtomu vosproizvodit'sja I vmeste s tem ty ne imeesh' prava ne skazat' ob ehtom potomu chto nu ehto estestvennoe zhelanie ili vsyo ehto budet nenastojaszim skonstruirovannym Vot samaja problema chto delat' EHto zamknutyj krug  Iz zamka v zamok iz lona v grob Iz samyhsamyh v polnyj zero Iz zala slavy v zagon gde skot Govna sansary krugovorot Iz zamka v zamok iz lona v grob Iz samyhsamyh v polnyj zero Iz zala slavy v zagon gde skot Govna sansary krugovorot  Izdavna i vo veki vekov tebe ne vybrat'sja iz monety okov Bud' ty hot' vyskochka ili vysokolobyj i mne uzhe huyovo ot moej ehtoj voni Ved' vsyo zrja vokrug sljakot' ja tjufjak slabyj v travu ljagu I otkazhus' idti v sledujuszij den' cherez grud' vzrastyot chereshnja i siren' Kuznechik veselej  mne kriknet gorod Ty zh muzykant Filipp Kirkorov A poehzija  Vera Polozkova skoro porodish' tyszu ehpigonov O tebe skazhet Vano Urgant na pervom ty v govno ubran Za tebja Rossija Brat 2 bol'shoj Dom 2 luzhajka trava I ja v nej lezhu nu i chto smenilos' ty otvet' mne suka Nu i chto smenilos' Komu ja dolzhen blagodaren byt' bozh'ej milosti I ja byl nikto  stal poshlyj pidor No znaesh' chto ja tebja obmanul JA mnu vsyo tu zhe prostuju travu kak i mjal v detstve kak kuru petuh I rosoj okropljal naguju pjatu No sebe na bedu i drugim ne v dobro Reshil zaplatit' kapitalu obrok Vstal s pechi i zabral vsyo bablo Kaliki perehozhie molvili slovo  Izdavna i vo veki vekov tebe ne vybrat'sja iz monety okov Bud' ty hot' vyskochka ili vysokolobyj i mne uzhe huyovo ot moej ehtoj voni Ved' vsyo zrja vokrug sljakot' ja tufjak slabyj v travu ljagu I otkazhus' idti v sledujuszij den' cherez grud' vzrostyot chereshnja i siren'  Iz zamka v zamok iz lona v grob Iz samyhsamyh v polnyj zero Iz zala slavy v zagon gde skot Govna sansary krugovorot Iz zamka v zamok iz lona v grob Iz samyhsamyh v polnyj zero Iz zala slavy v zagon gde skot Govna sansary krugovorot
134,Privet vsem tem kto v zhope kto ljubit medlennyj shoping Raz v desjat' let na izzhoge kak vybrat' telu pomodnee meshok i Tem kto shyol obnazhyonnym i shyol sneg cherez doly bezropotno vosled Idealu bezbozhnik i asket a potom ohuel ili oslep Net zlodej ne dremlet alkaet bol'shego zlata My kak v belom getto  negry zhivyom do zarplaty V kuplete moyom dyry lish' slyozy  zaplaty Glaza krovavye voshodyzakaty Gde kazhdyj poddatyj pljus novyj den'  tol'ko pota reka Tonu  di Kaprio idejno ja nedogopnik i pank V adu pamjatnik prohindej Zurab vozvedyot velikan no Poka ne Kamenev srazhajsja bljat' ved' eszyo ne final  Iz grjazi v grjazi cherez golovy my prygskok Iz grjazi v grjazi idti zdorovo kol' ty snob Iz grjazi v grjazi Ty lish' na storonu szemis' gop Iz grjazi v grjazi  Uil'jam Donovan shutnik  grob  Slysh' Iz grjazi v grjazi slovno so dna naverh ty Podnimajsja Hazin krasnym dal kart blansh na uspeh mir Kak hozjain jazi pyzhitsja odnako prover' hil EHti mrazi v rjase nam ne oblomajut uteh Siks CHetvyortyj golyj korol' na obolgannyj gorod Nu ih k chyortu EHto shtorm v monitory i torrent JA grub podchyorknuto s temi kto prikormlen ikonoj Ohuenno smeshnoj narod kak prikoly nemogo Moj d'javol prekrasen On pozvoljaet nad sud'boj azaza Ot#javlennoj mraz'ju maksimum boli uvol'nogo zla Asja Kaljasina ocenit moj flou uvolit osla ST I Ren kak pirozhok stancuet buhoj za beznal  Iz grjazi v grjazi cherez golovy my prygskok Iz grjazi v grjazi idti zdorovo kol' ty snob Iz grjazi v grjazi Ty lish' na storonu szemis' gop Iz grjazi v grjazi  Uil'jam Donovan shutnik  grob Iz grjazi v grjazi cherez golovy my prygskok Iz grjazi v grjazi idti zdorovo kol' ty snob Iz grjazi v grjazi Ty lish' na storonu szemis' gop Iz grjazi v grjazi  Uil'jam Donovan shutnik  grob
135,Mmm a chto bylo dal'she  Dovedeny do predela ehtimi pesnjami serymi Korabli chto na meli ne smogut vyrastit' geniev Nadoeli vse Libo na reju gde Budesh' viset' za zamarannye letopisi Ili smotrika est' drugoj variant Kontrol'nyj paket akcij vlast' sjuda daj Faraonovo vremja ushlo porovnu delim I Vashington ehtih prjamyh ehfirov kafirovy blja nu i chto  Ob#javite gady mne svoi imena Pokazhite lichinu pochinu Paperu frak Vasha tema vydumana i ne  Moj narod so mnoj i my idyom vperyod boy Ob#javite gady mne svoi imena Pokazhite lichinu pochinu Paperu frak Vasha tema vydumana i ne  Moj narod so mnoj i my gotovy k ozeru krovi  A nas bol'she chem sorok tysjach Massy hoteli nas vysech' no my rasa zakalyonnyh fizicheski CHerez pustyni nedoponimanija My bodro shagali na forumy Oblagali togda ne hujami vseh i kak pravilo Staralis' vypuskat' al'bomov po sotne v den' Teper' uzh novaja stadija i kak Gordonu Braunu Strogo pohuj chto skazhesh' mne Vyrublju Novyj Zavet Iz gornoj porody Vorota v raj nam zakryty v ad nam doroga bro Besplatnyj download  novyj moj bog Emu poklonjajus' poka rjasy ebut mozg Kogda ljasy katali kos kosvennym sposobom Tochet na chuzhoj prihod hochet pobol'she on Gelendvagen My rvemsja v ehfir Slushat' na Sinae nas budut zhiteli Mal'div  Ob#javite gady mne svoi imena Pokazhite lichinu pochinu Paperu frak Vasha tema vydumana i ne  Moj narod so mnoj i my idyom vperyod boy Ob#javite mne gady svoi imena Pokazhite lichinu pochinu Paperu frak Vasha tema vydumana i ne  Moj narod so mnoj i my gotovy k ozeru krovi  V chyom rehpa koren' Mne pohuj Delaj muzon dostojnyj V pervuju ochered' tema ehta nekotoryh kormit lish' JA ne pobornik Rehpom schitat' svoyo hobbi EHto moja zhizn' ja psih ja tut do groba Koronu deljat ubogie ved' EHto obszee delo ved' ne prosto obszaja vesz' Ha EHto vsyo namnogo bolee chem Mozhet uvidet' po tv nepodgotovlennyj chel  Ob#javite gady mne svoi imena Pokazhite lichinu pochinu Paperu frak Vasha tema vydumana i ne  Moj narod so mnoj i my idyom vperyod boy Ob#javite gady svoi imena Pokazhite lichinu pochinu Paperu frak Vasha tema vydumana i ne  Moj narod so mnoj i my gotovy k ozeru krovi Ob#javite gady mne svoi imena Pokazhite lichinu pochinu Paperu frak Vasha tema vydumana i ne  Moj narod so mnoj i my idyom vperyod boy Ob#javite gady svoi imena Pokazhite lichinu pochinu Paperu frak Vasha tema vydumana i ne  Moj narod so mnoj i my gotovy k ozeru krovi
136,Han Zamaj Zamaj Zamaj Zamaj Zamaj Zamaj Zamaj V preispodnjuju koridor  Udushajuszij potok kak Neva iz beregov Muzyka dlja mudakov ty znaesh' imja bratok Zamaj Zamaj Zamaj Zamaj Zamaj Zamaj  v preispodnjuju koridor Udushajuszij potok kak Neva iz beregov Muzyka dlja mudakov ty znaesh' imja bratok Zamaj Zamaj Zamaj Zamaj Zamaj Zamaj  v preispodnjuju koridor  Kto Samyj nenavidimyj MC Kak podorvat' paru plebejskih zadnic sprosi recept sprosi EHto kapisze bitov i sotni otvergnutyh shem I chtob ty znal mne po kajfu blja dazhe esli ja na dne JA ohuel privet prodolzhiv delat' smysl Moj kuplet kak prochest' paru sranyh knizhek Pizdec ebat' ja umnyj budto JUrij Luzhkov I ja kak Schokk 2010 da ja kul'turnyj shok saljut Videl ehto videl to videl nichego Poka ty biografiju svoju drochil v mikro Raskovyrjaj ranku da pomenjaj rakurs No za dushoj takzhe sverhdyrjavyj anus I poshel nahuj durak i poshel nahuj durak Govorjat kazhdyj den' i ja rebjata rad otvechaju A potomu chto na sistemu klal gigantskij huj Menja voznenavidit vremja vas pohvalit Dud' ja tut  Udushajuszij potok kak Neva iz beregov Muzyka dlja mudakov ty znaesh' imja bratok Zamaj Zamaj Zamaj Zamaj Zamaj Zamaj v preispodnjuju koridor Udushajuszij potok kak Neva iz beregov Muzyka dlja mudakov ty znaesh' imja bratok Zamaj Zamaj Zamaj Zamaj Zamaj Zamaj  v preispodnjuju koridor  Ebal Pelevina v rot sam lichno Dostoevskij  huesos ja videl Brodskij podaj nomerok ehj bratishka vasha kul'tura  govno No ja tut prishel chto b spasti Rus' spasite JA pil vodjaru s gruzchikami ja postig sut' Polubol'noj ehal zajcem a moj bratka pogib Iz Bishkeka poka vash sranyj raj  MoskvaPetushki EHto ne tru ehto ne trudno  rasskazat' kak ty hodil V edinstvennoj kurtke ty tup kak zalupa Ne Kurt Kobejn vertet' vselennuju na bolte  Dlja normal'nyh ljudej ehto pervaja est' dobrodetel' I pospor' so mnoj ehto sport samo soboj Provodit' ehkzekuciju polosti rotovoj Na skorost' na vremja osvobozhdenie prinosit bol' JA tut Daniehl' Ortega a ty lish' Somosa boy oj  Udushajuszij potok kak Neva iz beregov Muzyka dlja mudakov ty znaesh' imja bratok Zamaj Zamaj Zamaj Zamaj Zamaj Zamaj v preispodnjuju koridor Udushajuszij potok kak Neva iz beregov Muzyka dlja mudakov ty znaesh' imja bratok Zamaj Zamaj Zamaj Zamaj Zamaj Zamaj  v preispodnjuju koridor
